root@lamp-ubuntu-s-1vcpu-1gb-tor1-01:~# tcpdump -i eth0
tcpdump: verbose output suppressed, use -v or -vv for full protocol decode
listening on eth0, link-type EN10MB (Ethernet), capture size 262144 bytes
22:54:46.858491 IP 159.203.43.128.ssh > bras-base-toroon0411w-grc-51-142-114-105-168.dsl.bell.ca.52873: Flags [P.], seq 1336899981:1336900089, ack 1113545372, win 501, length 108
22:54:46.858567 IP 159.203.43.128.ssh > bras-base-toroon0411w-grc-51-142-114-105-168.dsl.bell.ca.52873: Flags [P.], seq 108:144, ack 1, win 501, length 36
22:54:46.858626 IP 159.203.43.128.ssh > bras-base-toroon0411w-grc-51-142-114-105-168.dsl.bell.ca.52873: Flags [P.], seq 144:252, ack 1, win 501, length 108
22:54:46.858674 IP 159.203.43.128.ssh > bras-base-toroon0411w-grc-51-142-114-105-168.dsl.bell.ca.52873: Flags [P.], seq 252:288, ack 1, win 501, length 36
22:54:46.859078 IP 159.203.43.128.57443 > dns.google.domain: 65453+ PTR? 168.105.114.142.in-addr.arpa. (46)
22:54:46.860023 IP bras-base-toroon0411w-grc-51-142-114-105-168.dsl.bell.ca.52873 > 159.203.43.128.ssh: Flags [.], ack 108, win 1021, length 0
22:54:46.860358 IP bras-base-toroon0411w-grc-51-142-114-105-168.dsl.bell.ca.52873 > 159.203.43.128.ssh: Flags [.], ack 288, win 1026, length 0
22:54:46.867399 IP dns.google.domain > 159.203.43.128.57443: 65453 1/0/0 PTR bras-base-toroon0411w-grc-51-142-114-105-168.dsl.bell.ca. (116)
22:54:46.867574 IP 159.203.43.128.48282 > dns.google.domain: 59849+ PTR? 128.43.203.159.in-addr.arpa. (45)
22:54:46.875970 IP dns.google.domain > 159.203.43.128.48282: 59849 NXDomain 0/1/0 (112)
22:54:46.876163 IP 159.203.43.128.ssh > bras-base-toroon0411w-grc-51-142-114-105-168.dsl.bell.ca.52873: Flags [P.], seq 288:500, ack 1, win 501, length 212
22:54:46.876231 IP 159.203.43.128.ssh > bras-base-toroon0411w-grc-51-142-114-105-168.dsl.bell.ca.52873: Flags [P.], seq 500:536, ack 1, win 501, length 36
22:54:46.876285 IP 159.203.43.128.ssh > bras-base-toroon0411w-grc-51-142-114-105-168.dsl.bell.ca.52873: Flags [P.], seq 536:724, ack 1, win 501, length 188
22:54:46.876325 IP 159.203.43.128.ssh > bras-base-toroon0411w-grc-51-142-114-105-168.dsl.bell.ca.52873: Flags [P.], seq 724:760, ack 1, win 501, length 36
22:54:46.876375 IP 159.203.43.128.ssh > bras-base-toroon0411w-grc-51-142-114-105-168.dsl.bell.ca.52873: Flags [P.], seq 760:956, ack 1, win 501, length 196
22:54:46.876414 IP 159.203.43.128.ssh > bras-base-toroon0411w-grc-51-142-114-105-168.dsl.bell.ca.52873: Flags [P.], seq 956:992, ack 1, win 501, length 36
22:54:46.876462 IP 159.203.43.128.ssh > bras-base-toroon0411w-grc-51-142-114-105-168.dsl.bell.ca.52873: Flags [P.], seq 992:1180, ack 1, win 501, length 188
22:54:46.876503 IP 159.203.43.128.ssh > bras-base-toroon0411w-grc-51-142-114-105-168.dsl.bell.ca.52873: Flags [P.], seq 1180:1216, ack 1, win 501, length 36
22:54:46.876607 IP 159.203.43.128.49077 > dns.google.domain: 3180+ PTR? 8.8.8.8.in-addr.arpa. (38)
22:54:46.877499 IP dns.google.domain > 159.203.43.128.49077: 3180 1/0/0 PTR dns.google. (62)
22:54:46.877588 IP 159.203.43.128.ssh > bras-base-toroon0411w-grc-51-142-114-105-168.dsl.bell.ca.52873: Flags [P.], seq 1216:1364, ack 1, win 501, length 148
22:54:46.877662 IP 159.203.43.128.ssh > bras-base-toroon0411w-grc-51-142-114-105-168.dsl.bell.ca.52873: Flags [P.], seq 1364:1400, ack 1, win 501, length 36
22:54:46.877706 IP bras-base-toroon0411w-grc-51-142-114-105-168.dsl.bell.ca.52873 > 159.203.43.128.ssh: Flags [.], ack 536, win 1025, length 0
22:54:46.877722 IP 159.203.43.128.ssh > bras-base-toroon0411w-grc-51-142-114-105-168.dsl.bell.ca.52873: Flags [P.], seq 1400:1580, ack 1, win 501, length 180
22:54:46.877762 IP 159.203.43.128.ssh > bras-base-toroon0411w-grc-51-142-114-105-168.dsl.bell.ca.52873: Flags [P.], seq 1580:1616, ack 1, win 501, length 36
22:54:46.877809 IP 159.203.43.128.ssh > bras-base-toroon0411w-grc-51-142-114-105-168.dsl.bell.ca.52873: Flags [P.], seq 1616:1796, ack 1, win 501, length 180
22:54:46.877846 IP 159.203.43.128.ssh > bras-base-toroon0411w-grc-51-142-114-105-168.dsl.bell.ca.52873: Flags [P.], seq 1796:1832, ack 1, win 501, length 36
22:54:46.877967 IP bras-base-toroon0411w-grc-51-142-114-105-168.dsl.bell.ca.52873 > 159.203.43.128.ssh: Flags [.], ack 1216, win 1022, length 0
22:54:46.877977 IP 159.203.43.128.ssh > bras-base-toroon0411w-grc-51-142-114-105-168.dsl.bell.ca.52873: Flags [P.], seq 1832:2224, ack 1, win 501, length 392
22:54:46.878036 IP 159.203.43.128.ssh > bras-base-toroon0411w-grc-51-142-114-105-168.dsl.bell.ca.52873: Flags [P.], seq 2224:2384, ack 1, win 501, length 160
22:54:46.878079 IP 159.203.43.128.ssh > bras-base-toroon0411w-grc-51-142-114-105-168.dsl.bell.ca.52873: Flags [P.], seq 2384:2580, ack 1, win 501, length 196
22:54:46.878115 IP 159.203.43.128.ssh > bras-base-toroon0411w-grc-51-142-114-105-168.dsl.bell.ca.52873: Flags [P.], seq 2580:2616, ack 1, win 501, length 36
22:54:46.878157 IP 159.203.43.128.ssh > bras-base-toroon0411w-grc-51-142-114-105-168.dsl.bell.ca.52873: Flags [P.], seq 2616:2804, ack 1, win 501, length 188
22:54:46.878193 IP 159.203.43.128.ssh > bras-base-toroon0411w-grc-51-142-114-105-168.dsl.bell.ca.52873: Flags [P.], seq 2804:2840, ack 1, win 501, length 36
22:54:46.878230 IP 159.203.43.128.ssh > bras-base-toroon0411w-grc-51-142-114-105-168.dsl.bell.ca.52873: Flags [P.], seq 2840:3036, ack 1, win 501, length 196
22:54:46.878260 IP 159.203.43.128.ssh > bras-base-toroon0411w-grc-51-142-114-105-168.dsl.bell.ca.52873: Flags [P.], seq 3036:3072, ack 1, win 501, length 36
22:54:46.878306 IP 159.203.43.128.ssh > bras-base-toroon0411w-grc-51-142-114-105-168.dsl.bell.ca.52873: Flags [P.], seq 3072:3260, ack 1, win 501, length 188
22:54:46.878340 IP 159.203.43.128.ssh > bras-base-toroon0411w-grc-51-142-114-105-168.dsl.bell.ca.52873: Flags [P.], seq 3260:3296, ack 1, win 501, length 36
22:54:46.878384 IP 159.203.43.128.ssh > bras-base-toroon0411w-grc-51-142-114-105-168.dsl.bell.ca.52873: Flags [P.], seq 3296:3492, ack 1, win 501, length 196
22:54:46.878420 IP 159.203.43.128.ssh > bras-base-toroon0411w-grc-51-142-114-105-168.dsl.bell.ca.52873: Flags [P.], seq 3492:3528, ack 1, win 501, length 36
22:54:46.879124 IP bras-base-toroon0411w-grc-51-142-114-105-168.dsl.bell.ca.52873 > 159.203.43.128.ssh: Flags [.], ack 1400, win 1022, length 0
22:54:46.879133 IP 159.203.43.128.ssh > bras-base-toroon0411w-grc-51-142-114-105-168.dsl.bell.ca.52873: Flags [P.], seq 3528:7732, ack 1, win 501, length 4204
22:54:46.879171 IP 159.203.43.128.ssh > bras-base-toroon0411w-grc-51-142-114-105-168.dsl.bell.ca.52873: Flags [P.], seq 7732:7768, ack 1, win 501, length 36
22:54:46.879463 IP bras-base-toroon0411w-grc-51-142-114-105-168.dsl.bell.ca.52873 > 159.203.43.128.ssh: Flags [.], ack 2580, win 1026, length 0
22:54:46.879476 IP 159.203.43.128.ssh > bras-base-toroon0411w-grc-51-142-114-105-168.dsl.bell.ca.52873: Flags [P.], seq 7768:9160, ack 1, win 501, length 1392
22:54:46.879526 IP 159.203.43.128.ssh > bras-base-toroon0411w-grc-51-142-114-105-168.dsl.bell.ca.52873: Flags [P.], seq 9160:9340, ack 1, win 501, length 180
22:54:46.879560 IP 159.203.43.128.ssh > bras-base-toroon0411w-grc-51-142-114-105-168.dsl.bell.ca.52873: Flags [P.], seq 9340:9376, ack 1, win 501, length 36
22:54:46.879604 IP 159.203.43.128.ssh > bras-base-toroon0411w-grc-51-142-114-105-168.dsl.bell.ca.52873: Flags [P.], seq 9376:9572, ack 1, win 501, length 196
22:54:46.879639 IP 159.203.43.128.ssh > bras-base-toroon0411w-grc-51-142-114-105-168.dsl.bell.ca.52873: Flags [P.], seq 9572:9608, ack 1, win 501, length 36
22:54:46.879677 IP 159.203.43.128.ssh > bras-base-toroon0411w-grc-51-142-114-105-168.dsl.bell.ca.52873: Flags [P.], seq 9608:9804, ack 1, win 501, length 196
22:54:46.879707 IP 159.203.43.128.ssh > bras-base-toroon0411w-grc-51-142-114-105-168.dsl.bell.ca.52873: Flags [P.], seq 9804:9840, ack 1, win 501, length 36
22:54:46.879725 IP bras-base-toroon0411w-grc-51-142-114-105-168.dsl.bell.ca.52873 > 159.203.43.128.ssh: Flags [.], ack 3296, win 1023, length 0
22:54:46.879766 IP 159.203.43.128.ssh > bras-base-toroon0411w-grc-51-142-114-105-168.dsl.bell.ca.52873: Flags [P.], seq 9840:10020, ack 1, win 501, length 180
22:54:46.879802 IP 159.203.43.128.ssh > bras-base-toroon0411w-grc-51-142-114-105-168.dsl.bell.ca.52873: Flags [P.], seq 10020:10056, ack 1, win 501, length 36
22:54:46.879846 IP 159.203.43.128.ssh > bras-base-toroon0411w-grc-51-142-114-105-168.dsl.bell.ca.52873: Flags [P.], seq 10056:10252, ack 1, win 501, length 196
22:54:46.879880 IP 159.203.43.128.ssh > bras-base-toroon0411w-grc-51-142-114-105-168.dsl.bell.ca.52873: Flags [P.], seq 10252:10288, ack 1, win 501, length 36
22:54:46.879922 IP 159.203.43.128.ssh > bras-base-toroon0411w-grc-51-142-114-105-168.dsl.bell.ca.52873: Flags [P.], seq 10288:10484, ack 1, win 501, length 196
22:54:46.879957 IP 159.203.43.128.ssh > bras-base-toroon0411w-grc-51-142-114-105-168.dsl.bell.ca.52873: Flags [P.], seq 10484:10520, ack 1, win 501, length 36
22:54:46.879997 IP 159.203.43.128.ssh > bras-base-toroon0411w-grc-51-142-114-105-168.dsl.bell.ca.52873: Flags [P.], seq 10520:10716, ack 1, win 501, length 196
22:54:46.880032 IP 159.203.43.128.ssh > bras-base-toroon0411w-grc-51-142-114-105-168.dsl.bell.ca.52873: Flags [P.], seq 10716:10752, ack 1, win 501, length 36
22:54:46.880076 IP 159.203.43.128.ssh > bras-base-toroon0411w-grc-51-142-114-105-168.dsl.bell.ca.52873: Flags [P.], seq 10752:10948, ack 1, win 501, length 196
22:54:46.880109 IP 159.203.43.128.ssh > bras-base-toroon0411w-grc-51-142-114-105-168.dsl.bell.ca.52873: Flags [P.], seq 10948:10984, ack 1, win 501, length 36
22:54:46.880176 IP 159.203.43.128.ssh > bras-base-toroon0411w-grc-51-142-114-105-168.dsl.bell.ca.52873: Flags [P.], seq 10984:11180, ack 1, win 501, length 196
22:54:46.880214 IP bras-base-toroon0411w-grc-51-142-114-105-168.dsl.bell.ca.52873 > 159.203.43.128.ssh: Flags [.], ack 3528, win 1022, length 0
22:54:46.880228 IP 159.203.43.128.ssh > bras-base-toroon0411w-grc-51-142-114-105-168.dsl.bell.ca.52873: Flags [P.], seq 11180:11216, ack 1, win 501, length 36
22:54:46.880277 IP 159.203.43.128.ssh > bras-base-toroon0411w-grc-51-142-114-105-168.dsl.bell.ca.52873: Flags [P.], seq 11216:11412, ack 1, win 501, length 196
22:54:46.880313 IP 159.203.43.128.ssh > bras-base-toroon0411w-grc-51-142-114-105-168.dsl.bell.ca.52873: Flags [P.], seq 11412:11448, ack 1, win 501, length 36
22:54:46.880354 IP 159.203.43.128.ssh > bras-base-toroon0411w-grc-51-142-114-105-168.dsl.bell.ca.52873: Flags [P.], seq 11448:11644, ack 1, win 501, length 196
22:54:46.880390 IP 159.203.43.128.ssh > bras-base-toroon0411w-grc-51-142-114-105-168.dsl.bell.ca.52873: Flags [P.], seq 11644:11680, ack 1, win 501, length 36
22:54:46.880433 IP 159.203.43.128.ssh > bras-base-toroon0411w-grc-51-142-114-105-168.dsl.bell.ca.52873: Flags [P.], seq 11680:11860, ack 1, win 501, length 180
22:54:46.880469 IP 159.203.43.128.ssh > bras-base-toroon0411w-grc-51-142-114-105-168.dsl.bell.ca.52873: Flags [P.], seq 11860:11896, ack 1, win 501, length 36
22:54:46.880512 IP 159.203.43.128.ssh > bras-base-toroon0411w-grc-51-142-114-105-168.dsl.bell.ca.52873: Flags [P.], seq 11896:12092, ack 1, win 501, length 196
22:54:46.880548 IP 159.203.43.128.ssh > bras-base-toroon0411w-grc-51-142-114-105-168.dsl.bell.ca.52873: Flags [P.], seq 12092:12128, ack 1, win 501, length 36
22:54:46.880591 IP 159.203.43.128.ssh > bras-base-toroon0411w-grc-51-142-114-105-168.dsl.bell.ca.52873: Flags [P.], seq 12128:12324, ack 1, win 501, length 196
22:54:46.880627 IP 159.203.43.128.ssh > bras-base-toroon0411w-grc-51-142-114-105-168.dsl.bell.ca.52873: Flags [P.], seq 12324:12360, ack 1, win 501, length 36
22:54:46.880669 IP 159.203.43.128.ssh > bras-base-toroon0411w-grc-51-142-114-105-168.dsl.bell.ca.52873: Flags [P.], seq 12360:12556, ack 1, win 501, length 196
22:54:46.880705 IP 159.203.43.128.ssh > bras-base-toroon0411w-grc-51-142-114-105-168.dsl.bell.ca.52873: Flags [P.], seq 12556:12592, ack 1, win 501, length 36
22:54:46.880749 IP 159.203.43.128.ssh > bras-base-toroon0411w-grc-51-142-114-105-168.dsl.bell.ca.52873: Flags [P.], seq 12592:12788, ack 1, win 501, length 196
22:54:46.880837 IP bras-base-toroon0411w-grc-51-142-114-105-168.dsl.bell.ca.52873 > 159.203.43.128.ssh: Flags [P.], seq 1:37, ack 3528, win 1022, length 36
22:54:46.880979 IP bras-base-toroon0411w-grc-51-142-114-105-168.dsl.bell.ca.52873 > 159.203.43.128.ssh: Flags [.], ack 3528, win 1022, options [nop,nop,sack 1 {4980:6432}], length 0
22:54:46.880979 IP bras-base-toroon0411w-grc-51-142-114-105-168.dsl.bell.ca.52873 > 159.203.43.128.ssh: Flags [.], ack 6432, win 1026, length 0
22:54:46.880999 IP 159.203.43.128.ssh > bras-base-toroon0411w-grc-51-142-114-105-168.dsl.bell.ca.52873: Flags [P.], seq 12788:13716, ack 37, win 501, length 928
22:54:46.881044 IP 159.203.43.128.ssh > bras-base-toroon0411w-grc-51-142-114-105-168.dsl.bell.ca.52873: Flags [P.], seq 13716:13752, ack 37, win 501, length 36
22:54:46.881093 IP bras-base-toroon0411w-grc-51-142-114-105-168.dsl.bell.ca.52873 > 159.203.43.128.ssh: Flags [.], ack 6432, win 1026, options [nop,nop,sack 1 {7732:7768}], length 0
22:54:46.881093 IP bras-base-toroon0411w-grc-51-142-114-105-168.dsl.bell.ca.52873 > 159.203.43.128.ssh: Flags [.], ack 7768, win 1021, length 0
22:54:46.881093 IP bras-base-toroon0411w-grc-51-142-114-105-168.dsl.bell.ca.52873 > 159.203.43.128.ssh: Flags [.], ack 7768, win 1021, options [nop,nop,sack 1 {9160:9340}], length 0
22:54:46.881093 IP bras-base-toroon0411w-grc-51-142-114-105-168.dsl.bell.ca.52873 > 159.203.43.128.ssh: Flags [.], ack 9340, win 1026, length 0
22:54:46.881120 IP 159.203.43.128.ssh > bras-base-toroon0411w-grc-51-142-114-105-168.dsl.bell.ca.52873: Flags [P.], seq 13752:13948, ack 37, win 501, length 196
22:54:46.881158 IP 159.203.43.128.ssh > bras-base-toroon0411w-grc-51-142-114-105-168.dsl.bell.ca.52873: Flags [P.], seq 13948:13984, ack 37, win 501, length 36
22:54:46.881208 IP 159.203.43.128.ssh > bras-base-toroon0411w-grc-51-142-114-105-168.dsl.bell.ca.52873: Flags [P.], seq 13984:14180, ack 37, win 501, length 196
22:54:46.881219 IP bras-base-toroon0411w-grc-51-142-114-105-168.dsl.bell.ca.52873 > 159.203.43.128.ssh: Flags [.], ack 9804, win 1024, length 0
22:54:46.881255 IP 159.203.43.128.ssh > bras-base-toroon0411w-grc-51-142-114-105-168.dsl.bell.ca.52873: Flags [P.], seq 14180:14216, ack 37, win 501, length 36
22:54:46.881300 IP 159.203.43.128.ssh > bras-base-toroon0411w-grc-51-142-114-105-168.dsl.bell.ca.52873: Flags [P.], seq 14216:14412, ack 37, win 501, length 196
22:54:46.881331 IP bras-base-toroon0411w-grc-51-142-114-105-168.dsl.bell.ca.52873 > 159.203.43.128.ssh: Flags [.], ack 10484, win 1022, length 0
22:54:46.881397 IP 159.203.43.128.ssh > bras-base-toroon0411w-grc-51-142-114-105-168.dsl.bell.ca.52873: Flags [P.], seq 14448:14628, ack 37, win 501, length 180
22:54:46.881471 IP bras-base-toroon0411w-grc-51-142-114-105-168.dsl.bell.ca.52873 > 159.203.43.128.ssh: Flags [.], ack 10984, win 1026, length 0
22:54:46.881581 IP 159.203.43.128.ssh > bras-base-toroon0411w-grc-51-142-114-105-168.dsl.bell.ca.52873: Flags [P.], seq 14896:15092, ack 37, win 501, length 196
22:54:46.881660 IP 159.203.43.128.ssh > bras-base-toroon0411w-grc-51-142-114-105-168.dsl.bell.ca.52873: Flags [P.], seq 15128:15324, ack 37, win 501, length 196
22:54:46.881746 IP 159.203.43.128.ssh > bras-base-toroon0411w-grc-51-142-114-105-168.dsl.bell.ca.52873: Flags [P.], seq 15360:15556, ack 37, win 501, length 196
22:54:46.881826 IP 159.203.43.128.ssh > bras-base-toroon0411w-grc-51-142-114-105-168.dsl.bell.ca.52873: Flags [P.], seq 15592:15788, ack 37, win 501, length 196
22:54:46.881904 IP 159.203.43.128.ssh > bras-base-toroon0411w-grc-51-142-114-105-168.dsl.bell.ca.52873: Flags [P.], seq 15824:16020, ack 37, win 501, length 196
22:54:46.881981 IP bras-base-toroon0411w-grc-51-142-114-105-168.dsl.bell.ca.52873 > 159.203.43.128.ssh: Flags [.], ack 12360, win 1021, length 0
22:54:46.882097 IP 159.203.43.128.ssh > bras-base-toroon0411w-grc-51-142-114-105-168.dsl.bell.ca.52873: Flags [P.], seq 16288:16484, ack 37, win 501, length 196
22:54:46.882174 IP 159.203.43.128.ssh > bras-base-toroon0411w-grc-51-142-114-105-168.dsl.bell.ca.52873: Flags [P.], seq 16520:16716, ack 37, win 501, length 196
22:54:46.882269 IP 159.203.43.128.ssh > bras-base-toroon0411w-grc-51-142-114-105-168.dsl.bell.ca.52873: Flags [P.], seq 16752:16948, ack 37, win 501, length 196
22:54:46.882346 IP 159.203.43.128.ssh > bras-base-toroon0411w-grc-51-142-114-105-168.dsl.bell.ca.52873: Flags [P.], seq 16984:17180, ack 37, win 501, length 196
22:54:46.882424 IP 159.203.43.128.ssh > bras-base-toroon0411w-grc-51-142-114-105-168.dsl.bell.ca.52873: Flags [P.], seq 17216:17412, ack 37, win 501, length 196
22:54:46.882503 IP 159.203.43.128.ssh > bras-base-toroon0411w-grc-51-142-114-105-168.dsl.bell.ca.52873: Flags [P.], seq 17448:17644, ack 37, win 501, length 196
22:54:46.882608 IP 159.203.43.128.ssh > bras-base-toroon0411w-grc-51-142-114-105-168.dsl.bell.ca.52873: Flags [P.], seq 17680:17876, ack 37, win 501, length 196
22:54:46.882687 IP 159.203.43.128.ssh > bras-base-toroon0411w-grc-51-142-114-105-168.dsl.bell.ca.52873: Flags [P.], seq 17912:18108, ack 37, win 501, length 196
22:54:46.882788 IP 159.203.43.128.ssh > bras-base-toroon0411w-grc-51-142-114-105-168.dsl.bell.ca.52873: Flags [P.], seq 18144:18364, ack 37, win 501, length 220
22:54:46.882868 IP 159.203.43.128.ssh > bras-base-toroon0411w-grc-51-142-114-105-168.dsl.bell.ca.52873: Flags [P.], seq 18400:18580, ack 37, win 501, length 180
22:54:46.882948 IP 159.203.43.128.ssh > bras-base-toroon0411w-grc-51-142-114-105-168.dsl.bell.ca.52873: Flags [P.], seq 18616:18812, ack 37, win 501, length 196
22:54:46.883042 IP 159.203.43.128.ssh > bras-base-toroon0411w-grc-51-142-114-105-168.dsl.bell.ca.52873: Flags [P.], seq 18848:19044, ack 37, win 501, length 196
22:54:46.883122 IP 159.203.43.128.ssh > bras-base-toroon0411w-grc-51-142-114-105-168.dsl.bell.ca.52873: Flags [P.], seq 19080:19300, ack 37, win 501, length 220
22:54:46.883304 IP 159.203.43.128.ssh > bras-base-toroon0411w-grc-51-142-114-105-168.dsl.bell.ca.52873: Flags [P.], seq 19336:19516, ack 37, win 501, length 180
22:54:46.883390 IP 159.203.43.128.ssh > bras-base-toroon0411w-grc-51-142-114-105-168.dsl.bell.ca.52873: Flags [P.], seq 19552:19772, ack 37, win 501, length 220
22:54:46.883487 IP 159.203.43.128.ssh > bras-base-toroon0411w-grc-51-142-114-105-168.dsl.bell.ca.52873: Flags [P.], seq 19808:19988, ack 37, win 501, length 180
22:54:46.883568 IP 159.203.43.128.ssh > bras-base-toroon0411w-grc-51-142-114-105-168.dsl.bell.ca.52873: Flags [P.], seq 20024:20220, ack 37, win 501, length 196
22:54:46.883645 IP 159.203.43.128.ssh > bras-base-toroon0411w-grc-51-142-114-105-168.dsl.bell.ca.52873: Flags [P.], seq 20256:20452, ack 37, win 501, length 196
22:54:46.883746 IP 159.203.43.128.ssh > bras-base-toroon0411w-grc-51-142-114-105-168.dsl.bell.ca.52873: Flags [P.], seq 20488:20684, ack 37, win 501, length 196
22:54:46.883825 IP 159.203.43.128.ssh > bras-base-toroon0411w-grc-51-142-114-105-168.dsl.bell.ca.52873: Flags [P.], seq 20720:20900, ack 37, win 501, length 180
22:54:46.883903 IP 159.203.43.128.ssh > bras-base-toroon0411w-grc-51-142-114-105-168.dsl.bell.ca.52873: Flags [P.], seq 20936:21132, ack 37, win 501, length 196
22:54:46.883963 IP bras-base-toroon0411w-grc-51-142-114-105-168.dsl.bell.ca.52873 > 159.203.43.128.ssh: Flags [.], ack 17216, win 1021, length 0
22:54:46.884078 IP 159.203.43.128.ssh > bras-base-toroon0411w-grc-51-142-114-105-168.dsl.bell.ca.52873: Flags [P.], seq 21400:21580, ack 37, win 501, length 180
22:54:46.884177 IP 159.203.43.128.ssh > bras-base-toroon0411w-grc-51-142-114-105-168.dsl.bell.ca.52873: Flags [P.], seq 21616:21812, ack 37, win 501, length 196
22:54:46.884257 IP 159.203.43.128.ssh > bras-base-toroon0411w-grc-51-142-114-105-168.dsl.bell.ca.52873: Flags [P.], seq 21848:22028, ack 37, win 501, length 180
22:54:46.884335 IP 159.203.43.128.ssh > bras-base-toroon0411w-grc-51-142-114-105-168.dsl.bell.ca.52873: Flags [P.], seq 22064:22260, ack 37, win 501, length 196
22:54:46.884411 IP 159.203.43.128.ssh > bras-base-toroon0411w-grc-51-142-114-105-168.dsl.bell.ca.52873: Flags [P.], seq 22296:22492, ack 37, win 501, length 196
22:54:46.884488 IP 159.203.43.128.ssh > bras-base-toroon0411w-grc-51-142-114-105-168.dsl.bell.ca.52873: Flags [P.], seq 22528:22724, ack 37, win 501, length 196
22:54:46.884565 IP 159.203.43.128.ssh > bras-base-toroon0411w-grc-51-142-114-105-168.dsl.bell.ca.52873: Flags [P.], seq 22760:22956, ack 37, win 501, length 196
22:54:46.884644 IP 159.203.43.128.ssh > bras-base-toroon0411w-grc-51-142-114-105-168.dsl.bell.ca.52873: Flags [P.], seq 22992:23188, ack 37, win 501, length 196
22:54:46.884714 IP bras-base-toroon0411w-grc-51-142-114-105-168.dsl.bell.ca.52873 > 159.203.43.128.ssh: Flags [.], ack 19080, win 1022, length 0
22:54:46.884845 IP bras-base-toroon0411w-grc-51-142-114-105-168.dsl.bell.ca.52873 > 159.203.43.128.ssh: Flags [.], ack 19552, win 1026, length 0
22:54:46.884952 IP bras-base-toroon0411w-grc-51-142-114-105-168.dsl.bell.ca.52873 > 159.203.43.128.ssh: Flags [.], ack 20220, win 1024, length 0
22:54:46.885193 IP 159.203.43.128.ssh > bras-base-toroon0411w-grc-51-142-114-105-168.dsl.bell.ca.52873: Flags [P.], seq 23904:24100, ack 37, win 501, length 196
22:54:46.885287 IP 159.203.43.128.ssh > bras-base-toroon0411w-grc-51-142-114-105-168.dsl.bell.ca.52873: Flags [P.], seq 24136:24332, ack 37, win 501, length 196
22:54:46.885379 IP 159.203.43.128.ssh > bras-base-toroon0411w-grc-51-142-114-105-168.dsl.bell.ca.52873: Flags [P.], seq 24368:24564, ack 37, win 501, length 196
22:54:46.885458 IP 159.203.43.128.ssh > bras-base-toroon0411w-grc-51-142-114-105-168.dsl.bell.ca.52873: Flags [P.], seq 24600:24796, ack 37, win 501, length 196
22:54:46.885535 IP 159.203.43.128.ssh > bras-base-toroon0411w-grc-51-142-114-105-168.dsl.bell.ca.52873: Flags [P.], seq 24832:25028, ack 37, win 501, length 196
22:54:46.885630 IP 159.203.43.128.ssh > bras-base-toroon0411w-grc-51-142-114-105-168.dsl.bell.ca.52873: Flags [P.], seq 25064:25260, ack 37, win 501, length 196
22:54:46.885710 IP 159.203.43.128.ssh > bras-base-toroon0411w-grc-51-142-114-105-168.dsl.bell.ca.52873: Flags [P.], seq 25296:25492, ack 37, win 501, length 196
22:54:46.885787 IP 159.203.43.128.ssh > bras-base-toroon0411w-grc-51-142-114-105-168.dsl.bell.ca.52873: Flags [P.], seq 25528:25724, ack 37, win 501, length 196
22:54:46.885873 IP 159.203.43.128.ssh > bras-base-toroon0411w-grc-51-142-114-105-168.dsl.bell.ca.52873: Flags [P.], seq 25760:25956, ack 37, win 501, length 196
22:54:46.885954 IP 159.203.43.128.ssh > bras-base-toroon0411w-grc-51-142-114-105-168.dsl.bell.ca.52873: Flags [P.], seq 25992:26188, ack 37, win 501, length 196
22:54:46.886001 IP 159.203.43.128.ssh > bras-base-toroon0411w-grc-51-142-114-105-168.dsl.bell.ca.52873: Flags [P.], seq 26188:26384, ack 37, win 501, length 196
22:54:46.886087 IP 159.203.43.128.ssh > bras-base-toroon0411w-grc-51-142-114-105-168.dsl.bell.ca.52873: Flags [P.], seq 26384:27228, ack 37, win 501, length 844
22:54:46.886163 IP 159.203.43.128.ssh > bras-base-toroon0411w-grc-51-142-114-105-168.dsl.bell.ca.52873: Flags [P.], seq 27228:27896, ack 37, win 501, length 668
22:54:46.886209 IP bras-base-toroon0411w-grc-51-142-114-105-168.dsl.bell.ca.52873 > 159.203.43.128.ssh: Flags [.], ack 23224, win 1026, length 0
22:54:46.886209 IP bras-base-toroon0411w-grc-51-142-114-105-168.dsl.bell.ca.52873 > 159.203.43.128.ssh: Flags [.], ack 23440, win 1025, length 0
22:54:46.886245 IP 159.203.43.128.ssh > bras-base-toroon0411w-grc-51-142-114-105-168.dsl.bell.ca.52873: Flags [P.], seq 27896:28420, ack 37, win 501, length 524
22:54:46.886321 IP 159.203.43.128.ssh > bras-base-toroon0411w-grc-51-142-114-105-168.dsl.bell.ca.52873: Flags [P.], seq 28420:29104, ack 37, win 501, length 684
22:54:46.886394 IP 159.203.43.128.ssh > bras-base-toroon0411w-grc-51-142-114-105-168.dsl.bell.ca.52873: Flags [P.], seq 29104:29740, ack 37, win 501, length 636
22:54:46.886466 IP 159.203.43.128.ssh > bras-base-toroon0411w-grc-51-142-114-105-168.dsl.bell.ca.52873: Flags [P.], seq 29740:30424, ack 37, win 501, length 684
22:54:46.886532 IP 159.203.43.128.ssh > bras-base-toroon0411w-grc-51-142-114-105-168.dsl.bell.ca.52873: Flags [P.], seq 30424:30948, ack 37, win 501, length 524
22:54:46.886604 IP 159.203.43.128.ssh > bras-base-toroon0411w-grc-51-142-114-105-168.dsl.bell.ca.52873: Flags [P.], seq 30948:31632, ack 37, win 501, length 684
22:54:46.886676 IP 159.203.43.128.ssh > bras-base-toroon0411w-grc-51-142-114-105-168.dsl.bell.ca.52873: Flags [P.], seq 31632:32284, ack 37, win 501, length 652
22:54:46.886704 IP bras-base-toroon0411w-grc-51-142-114-105-168.dsl.bell.ca.52873 > 159.203.43.128.ssh: Flags [.], ack 23672, win 1024, length 0
22:54:46.886781 IP 159.203.43.128.ssh > bras-base-toroon0411w-grc-51-142-114-105-168.dsl.bell.ca.52873: Flags [P.], seq 32284:33128, ack 37, win 501, length 844
22:54:46.886876 IP 159.203.43.128.ssh > bras-base-toroon0411w-grc-51-142-114-105-168.dsl.bell.ca.52873: Flags [P.], seq 33128:33796, ack 37, win 501, length 668
22:54:46.886931 IP 159.203.43.128.ssh > bras-base-toroon0411w-grc-51-142-114-105-168.dsl.bell.ca.52873: Flags [P.], seq 33796:33992, ack 37, win 501, length 196
22:54:46.886974 IP bras-base-toroon0411w-grc-51-142-114-105-168.dsl.bell.ca.52873 > 159.203.43.128.ssh: Flags [.], ack 24332, win 1022, length 0
22:54:46.886974 IP bras-base-toroon0411w-grc-51-142-114-105-168.dsl.bell.ca.52873 > 159.203.43.128.ssh: Flags [.], ack 24832, win 1026, length 0
22:54:46.887017 IP 159.203.43.128.ssh > bras-base-toroon0411w-grc-51-142-114-105-168.dsl.bell.ca.52873: Flags [P.], seq 33992:34332, ack 37, win 501, length 340
22:54:46.887089 IP bras-base-toroon0411w-grc-51-142-114-105-168.dsl.bell.ca.52873 > 159.203.43.128.ssh: Flags [.], ack 25528, win 1023, length 0
22:54:46.887095 IP 159.203.43.128.ssh > bras-base-toroon0411w-grc-51-142-114-105-168.dsl.bell.ca.52873: Flags [P.], seq 34332:34680, ack 37, win 501, length 348
22:54:46.887160 IP 159.203.43.128.ssh > bras-base-toroon0411w-grc-51-142-114-105-168.dsl.bell.ca.52873: Flags [P.], seq 34680:35028, ack 37, win 501, length 348
22:54:46.887214 IP 159.203.43.128.ssh > bras-base-toroon0411w-grc-51-142-114-105-168.dsl.bell.ca.52873: Flags [P.], seq 35028:35224, ack 37, win 501, length 196
22:54:46.887265 IP 159.203.43.128.ssh > bras-base-toroon0411w-grc-51-142-114-105-168.dsl.bell.ca.52873: Flags [P.], seq 35224:35420, ack 37, win 501, length 196
22:54:46.887317 IP 159.203.43.128.ssh > bras-base-toroon0411w-grc-51-142-114-105-168.dsl.bell.ca.52873: Flags [P.], seq 35420:35616, ack 37, win 501, length 196
22:54:46.887369 IP 159.203.43.128.ssh > bras-base-toroon0411w-grc-51-142-114-105-168.dsl.bell.ca.52873: Flags [P.], seq 35616:35812, ack 37, win 501, length 196
22:54:46.887421 IP 159.203.43.128.ssh > bras-base-toroon0411w-grc-51-142-114-105-168.dsl.bell.ca.52873: Flags [P.], seq 35812:36008, ack 37, win 501, length 196
22:54:46.887451 IP bras-base-toroon0411w-grc-51-142-114-105-168.dsl.bell.ca.52873 > 159.203.43.128.ssh: Flags [.], ack 26188, win 1021, length 0
22:54:46.887498 IP 159.203.43.128.ssh > bras-base-toroon0411w-grc-51-142-114-105-168.dsl.bell.ca.52873: Flags [P.], seq 36008:36356, ack 37, win 501, length 348
22:54:46.887553 IP 159.203.43.128.ssh > bras-base-toroon0411w-grc-51-142-114-105-168.dsl.bell.ca.52873: Flags [P.], seq 36356:36552, ack 37, win 501, length 196
22:54:46.887605 IP 159.203.43.128.ssh > bras-base-toroon0411w-grc-51-142-114-105-168.dsl.bell.ca.52873: Flags [P.], seq 36552:36748, ack 37, win 501, length 196
22:54:46.887657 IP 159.203.43.128.ssh > bras-base-toroon0411w-grc-51-142-114-105-168.dsl.bell.ca.52873: Flags [P.], seq 36748:36944, ack 37, win 501, length 196
22:54:46.887709 IP 159.203.43.128.ssh > bras-base-toroon0411w-grc-51-142-114-105-168.dsl.bell.ca.52873: Flags [P.], seq 36944:37140, ack 37, win 501, length 196
22:54:46.887722 IP bras-base-toroon0411w-grc-51-142-114-105-168.dsl.bell.ca.52873 > 159.203.43.128.ssh: Flags [.], ack 27228, win 1026, length 0
22:54:46.887787 IP 159.203.43.128.ssh > bras-base-toroon0411w-grc-51-142-114-105-168.dsl.bell.ca.52873: Flags [P.], seq 37140:37488, ack 37, win 501, length 348
22:54:46.887843 IP 159.203.43.128.ssh > bras-base-toroon0411w-grc-51-142-114-105-168.dsl.bell.ca.52873: Flags [P.], seq 37488:37684, ack 37, win 501, length 196
22:54:46.887895 IP 159.203.43.128.ssh > bras-base-toroon0411w-grc-51-142-114-105-168.dsl.bell.ca.52873: Flags [P.], seq 37684:37880, ack 37, win 501, length 196
22:54:46.887947 IP 159.203.43.128.ssh > bras-base-toroon0411w-grc-51-142-114-105-168.dsl.bell.ca.52873: Flags [P.], seq 37880:38076, ack 37, win 501, length 196
22:54:46.887967 IP bras-base-toroon0411w-grc-51-142-114-105-168.dsl.bell.ca.52873 > 159.203.43.128.ssh: Flags [.], ack 29104, win 1026, length 0
22:54:46.887967 IP bras-base-toroon0411w-grc-51-142-114-105-168.dsl.bell.ca.52873 > 159.203.43.128.ssh: Flags [.], ack 30948, win 1026, length 0
22:54:46.888032 IP 159.203.43.128.ssh > bras-base-toroon0411w-grc-51-142-114-105-168.dsl.bell.ca.52873: Flags [P.], seq 38076:38568, ack 37, win 501, length 492
22:54:46.888088 IP 159.203.43.128.ssh > bras-base-toroon0411w-grc-51-142-114-105-168.dsl.bell.ca.52873: Flags [P.], seq 38568:38764, ack 37, win 501, length 196
22:54:46.888115 IP bras-base-toroon0411w-grc-51-142-114-105-168.dsl.bell.ca.52873 > 159.203.43.128.ssh: Flags [.], ack 32284, win 1021, length 0
22:54:46.888188 IP 159.203.43.128.ssh > bras-base-toroon0411w-grc-51-142-114-105-168.dsl.bell.ca.52873: Flags [P.], seq 38764:39112, ack 37, win 501, length 348
22:54:46.888264 IP 159.203.43.128.ssh > bras-base-toroon0411w-grc-51-142-114-105-168.dsl.bell.ca.52873: Flags [P.], seq 39112:39308, ack 37, win 501, length 196
22:54:46.888343 IP bras-base-toroon0411w-grc-51-142-114-105-168.dsl.bell.ca.52873 > 159.203.43.128.ssh: Flags [.], ack 33992, win 1026, length 0
22:54:46.888361 IP 159.203.43.128.ssh > bras-base-toroon0411w-grc-51-142-114-105-168.dsl.bell.ca.52873: Flags [P.], seq 39308:39504, ack 37, win 501, length 196
22:54:46.888441 IP 159.203.43.128.ssh > bras-base-toroon0411w-grc-51-142-114-105-168.dsl.bell.ca.52873: Flags [P.], seq 39504:39852, ack 37, win 501, length 348
22:54:46.888503 IP 159.203.43.128.ssh > bras-base-toroon0411w-grc-51-142-114-105-168.dsl.bell.ca.52873: Flags [P.], seq 39852:40048, ack 37, win 501, length 196
22:54:46.888602 IP 159.203.43.128.ssh > bras-base-toroon0411w-grc-51-142-114-105-168.dsl.bell.ca.52873: Flags [P.], seq 40048:40244, ack 37, win 501, length 196
22:54:46.888669 IP 159.203.43.128.ssh > bras-base-toroon0411w-grc-51-142-114-105-168.dsl.bell.ca.52873: Flags [P.], seq 40244:40440, ack 37, win 501, length 196
22:54:46.888712 IP bras-base-toroon0411w-grc-51-142-114-105-168.dsl.bell.ca.52873 > 159.203.43.128.ssh: Flags [.], ack 35028, win 1022, length 0
22:54:46.888762 IP 159.203.43.128.ssh > bras-base-toroon0411w-grc-51-142-114-105-168.dsl.bell.ca.52873: Flags [P.], seq 40440:40788, ack 37, win 501, length 348
22:54:46.888815 IP 159.203.43.128.ssh > bras-base-toroon0411w-grc-51-142-114-105-168.dsl.bell.ca.52873: Flags [P.], seq 40788:40984, ack 37, win 501, length 196
22:54:46.888869 IP 159.203.43.128.ssh > bras-base-toroon0411w-grc-51-142-114-105-168.dsl.bell.ca.52873: Flags [P.], seq 40984:41180, ack 37, win 501, length 196
22:54:46.888942 IP 159.203.43.128.ssh > bras-base-toroon0411w-grc-51-142-114-105-168.dsl.bell.ca.52873: Flags [P.], seq 41180:41376, ack 37, win 501, length 196
22:54:46.888980 IP bras-base-toroon0411w-grc-51-142-114-105-168.dsl.bell.ca.52873 > 159.203.43.128.ssh: Flags [.], ack 35616, win 1026, length 0
22:54:46.888981 IP bras-base-toroon0411w-grc-51-142-114-105-168.dsl.bell.ca.52873 > 159.203.43.128.ssh: Flags [.], ack 36552, win 1022, length 0
22:54:46.889083 IP bras-base-toroon0411w-grc-51-142-114-105-168.dsl.bell.ca.52873 > 159.203.43.128.ssh: Flags [.], ack 37140, win 1026, length 0
22:54:46.889103 IP 159.203.43.128.ssh > bras-base-toroon0411w-grc-51-142-114-105-168.dsl.bell.ca.52873: Flags [P.], seq 41376:41868, ack 37, win 501, length 492
22:54:46.889198 IP 159.203.43.128.ssh > bras-base-toroon0411w-grc-51-142-114-105-168.dsl.bell.ca.52873: Flags [P.], seq 41868:42216, ack 37, win 501, length 348
22:54:46.889261 IP 159.203.43.128.ssh > bras-base-toroon0411w-grc-51-142-114-105-168.dsl.bell.ca.52873: Flags [P.], seq 42216:42412, ack 37, win 501, length 196
22:54:46.889314 IP 159.203.43.128.ssh > bras-base-toroon0411w-grc-51-142-114-105-168.dsl.bell.ca.52873: Flags [P.], seq 42412:42608, ack 37, win 501, length 196
22:54:46.889366 IP 159.203.43.128.ssh > bras-base-toroon0411w-grc-51-142-114-105-168.dsl.bell.ca.52873: Flags [P.], seq 42608:42804, ack 37, win 501, length 196
22:54:46.889416 IP 159.203.43.128.ssh > bras-base-toroon0411w-grc-51-142-114-105-168.dsl.bell.ca.52873: Flags [P.], seq 42804:43000, ack 37, win 501, length 196
22:54:46.889467 IP bras-base-toroon0411w-grc-51-142-114-105-168.dsl.bell.ca.52873 > 159.203.43.128.ssh: Flags [.], ack 38076, win 1022, length 0
22:54:46.889484 IP 159.203.43.128.ssh > bras-base-toroon0411w-grc-51-142-114-105-168.dsl.bell.ca.52873: Flags [P.], seq 43000:43196, ack 37, win 501, length 196
22:54:46.889548 IP 159.203.43.128.ssh > bras-base-toroon0411w-grc-51-142-114-105-168.dsl.bell.ca.52873: Flags [P.], seq 43196:43544, ack 37, win 501, length 348
22:54:46.889583 IP bras-base-toroon0411w-grc-51-142-114-105-168.dsl.bell.ca.52873 > 159.203.43.128.ssh: Flags [.], ack 38764, win 1026, length 0
22:54:46.889643 IP 159.203.43.128.ssh > bras-base-toroon0411w-grc-51-142-114-105-168.dsl.bell.ca.52873: Flags [P.], seq 43544:43892, ack 37, win 501, length 348
22:54:46.889740 IP 159.203.43.128.ssh > bras-base-toroon0411w-grc-51-142-114-105-168.dsl.bell.ca.52873: Flags [P.], seq 43892:44088, ack 37, win 501, length 196
22:54:46.889798 IP 159.203.43.128.ssh > bras-base-toroon0411w-grc-51-142-114-105-168.dsl.bell.ca.52873: Flags [P.], seq 44088:44284, ack 37, win 501, length 196
22:54:46.889851 IP 159.203.43.128.ssh > bras-base-toroon0411w-grc-51-142-114-105-168.dsl.bell.ca.52873: Flags [P.], seq 44284:44480, ack 37, win 501, length 196
22:54:46.889903 IP 159.203.43.128.ssh > bras-base-toroon0411w-grc-51-142-114-105-168.dsl.bell.ca.52873: Flags [P.], seq 44480:44676, ack 37, win 501, length 196
22:54:46.889954 IP 159.203.43.128.ssh > bras-base-toroon0411w-grc-51-142-114-105-168.dsl.bell.ca.52873: Flags [P.], seq 44676:44872, ack 37, win 501, length 196
22:54:46.890006 IP 159.203.43.128.ssh > bras-base-toroon0411w-grc-51-142-114-105-168.dsl.bell.ca.52873: Flags [P.], seq 44872:45068, ack 37, win 501, length 196
22:54:46.890056 IP 159.203.43.128.ssh > bras-base-toroon0411w-grc-51-142-114-105-168.dsl.bell.ca.52873: Flags [P.], seq 45068:45264, ack 37, win 501, length 196
22:54:46.890108 IP 159.203.43.128.ssh > bras-base-toroon0411w-grc-51-142-114-105-168.dsl.bell.ca.52873: Flags [P.], seq 45264:45460, ack 37, win 501, length 196
22:54:46.890161 IP 159.203.43.128.ssh > bras-base-toroon0411w-grc-51-142-114-105-168.dsl.bell.ca.52873: Flags [P.], seq 45460:45656, ack 37, win 501, length 196
22:54:46.890213 IP 159.203.43.128.ssh > bras-base-toroon0411w-grc-51-142-114-105-168.dsl.bell.ca.52873: Flags [P.], seq 45656:45852, ack 37, win 501, length 196
22:54:46.890265 IP 159.203.43.128.ssh > bras-base-toroon0411w-grc-51-142-114-105-168.dsl.bell.ca.52873: Flags [P.], seq 45852:46048, ack 37, win 501, length 196
22:54:46.890317 IP 159.203.43.128.ssh > bras-base-toroon0411w-grc-51-142-114-105-168.dsl.bell.ca.52873: Flags [P.], seq 46048:46244, ack 37, win 501, length 196
22:54:46.890369 IP 159.203.43.128.ssh > bras-base-toroon0411w-grc-51-142-114-105-168.dsl.bell.ca.52873: Flags [P.], seq 46244:46440, ack 37, win 501, length 196
22:54:46.890421 IP 159.203.43.128.ssh > bras-base-toroon0411w-grc-51-142-114-105-168.dsl.bell.ca.52873: Flags [P.], seq 46440:46636, ack 37, win 501, length 196
22:54:46.890473 IP 159.203.43.128.ssh > bras-base-toroon0411w-grc-51-142-114-105-168.dsl.bell.ca.52873: Flags [P.], seq 46636:46832, ack 37, win 501, length 196
22:54:46.890525 IP 159.203.43.128.ssh > bras-base-toroon0411w-grc-51-142-114-105-168.dsl.bell.ca.52873: Flags [P.], seq 46832:47028, ack 37, win 501, length 196
22:54:46.890577 IP 159.203.43.128.ssh > bras-base-toroon0411w-grc-51-142-114-105-168.dsl.bell.ca.52873: Flags [P.], seq 47028:47224, ack 37, win 501, length 196
22:54:46.890629 IP 159.203.43.128.ssh > bras-base-toroon0411w-grc-51-142-114-105-168.dsl.bell.ca.52873: Flags [P.], seq 47224:47420, ack 37, win 501, length 196
22:54:46.890681 IP 159.203.43.128.ssh > bras-base-toroon0411w-grc-51-142-114-105-168.dsl.bell.ca.52873: Flags [P.], seq 47420:47616, ack 37, win 501, length 196
22:54:46.890709 IP bras-base-toroon0411w-grc-51-142-114-105-168.dsl.bell.ca.52873 > 159.203.43.128.ssh: Flags [.], ack 41180, win 1026, length 0
22:54:46.890762 IP 159.203.43.128.ssh > bras-base-toroon0411w-grc-51-142-114-105-168.dsl.bell.ca.52873: Flags [P.], seq 47616:47964, ack 37, win 501, length 348
22:54:46.890823 IP 159.203.43.128.ssh > bras-base-toroon0411w-grc-51-142-114-105-168.dsl.bell.ca.52873: Flags [P.], seq 47964:48160, ack 37, win 501, length 196
22:54:46.890832 IP bras-base-toroon0411w-grc-51-142-114-105-168.dsl.bell.ca.52873 > 159.203.43.128.ssh: Flags [.], ack 42804, win 1026, length 0
22:54:46.890891 IP 159.203.43.128.ssh > bras-base-toroon0411w-grc-51-142-114-105-168.dsl.bell.ca.52873: Flags [P.], seq 48160:48508, ack 37, win 501, length 348
22:54:46.890947 IP 159.203.43.128.ssh > bras-base-toroon0411w-grc-51-142-114-105-168.dsl.bell.ca.52873: Flags [P.], seq 48508:48704, ack 37, win 501, length 196
22:54:46.890959 IP bras-base-toroon0411w-grc-51-142-114-105-168.dsl.bell.ca.52873 > 159.203.43.128.ssh: Flags [.], ack 43544, win 1023, length 0
22:54:46.891017 IP 159.203.43.128.ssh > bras-base-toroon0411w-grc-51-142-114-105-168.dsl.bell.ca.52873: Flags [P.], seq 48704:49052, ack 37, win 501, length 348
22:54:46.891072 IP 159.203.43.128.ssh > bras-base-toroon0411w-grc-51-142-114-105-168.dsl.bell.ca.52873: Flags [P.], seq 49052:49248, ack 37, win 501, length 196
22:54:46.891124 IP 159.203.43.128.ssh > bras-base-toroon0411w-grc-51-142-114-105-168.dsl.bell.ca.52873: Flags [P.], seq 49248:49444, ack 37, win 501, length 196
22:54:46.891174 IP 159.203.43.128.ssh > bras-base-toroon0411w-grc-51-142-114-105-168.dsl.bell.ca.52873: Flags [P.], seq 49444:49640, ack 37, win 501, length 196
22:54:46.891210 IP bras-base-toroon0411w-grc-51-142-114-105-168.dsl.bell.ca.52873 > 159.203.43.128.ssh: Flags [.], ack 44284, win 1026, length 0
22:54:46.891253 IP 159.203.43.128.ssh > bras-base-toroon0411w-grc-51-142-114-105-168.dsl.bell.ca.52873: Flags [P.], seq 49640:49988, ack 37, win 501, length 348
22:54:46.891307 IP 159.203.43.128.ssh > bras-base-toroon0411w-grc-51-142-114-105-168.dsl.bell.ca.52873: Flags [P.], seq 49988:50184, ack 37, win 501, length 196
22:54:46.891360 IP 159.203.43.128.ssh > bras-base-toroon0411w-grc-51-142-114-105-168.dsl.bell.ca.52873: Flags [P.], seq 50184:50380, ack 37, win 501, length 196
22:54:46.891411 IP 159.203.43.128.ssh > bras-base-toroon0411w-grc-51-142-114-105-168.dsl.bell.ca.52873: Flags [P.], seq 50380:50576, ack 37, win 501, length 196
22:54:46.891474 IP 159.203.43.128.ssh > bras-base-toroon0411w-grc-51-142-114-105-168.dsl.bell.ca.52873: Flags [P.], seq 50576:50772, ack 37, win 501, length 196
22:54:46.891569 IP 159.203.43.128.ssh > bras-base-toroon0411w-grc-51-142-114-105-168.dsl.bell.ca.52873: Flags [P.], seq 50772:50968, ack 37, win 501, length 196
