root@lamp-ubuntu-s-1vcpu-1gb-tor1-01:~# tcpdump -i eth0 port 22
tcpdump: verbose output suppressed, use -v or -vv for full protocol decode
listening on eth0, link-type EN10MB (Ethernet), capture size 262144 bytes
23:07:06.666874 IP 159.203.43.128.ssh > bras-base-toroon0411w-grc-51-142-114-105-168.dsl.bell.ca.53164: Flags [P.], seq 1295520590:1295520698, ack 2291615152, win 501, length 108
23:07:06.666949 IP 159.203.43.128.ssh > bras-base-toroon0411w-grc-51-142-114-105-168.dsl.bell.ca.53164: Flags [P.], seq 108:144, ack 1, win 501, length 36
23:07:06.667018 IP 159.203.43.128.ssh > bras-base-toroon0411w-grc-51-142-114-105-168.dsl.bell.ca.53164: Flags [P.], seq 144:252, ack 1, win 501, length 108
23:07:06.667070 IP 159.203.43.128.ssh > bras-base-toroon0411w-grc-51-142-114-105-168.dsl.bell.ca.53164: Flags [P.], seq 252:288, ack 1, win 501, length 36
23:07:06.668388 IP bras-base-toroon0411w-grc-51-142-114-105-168.dsl.bell.ca.53164 > 159.203.43.128.ssh: Flags [.], ack 108, win 1022, length 0
23:07:06.668533 IP bras-base-toroon0411w-grc-51-142-114-105-168.dsl.bell.ca.53164 > 159.203.43.128.ssh: Flags [.], ack 288, win 1022, length 0
23:07:06.686026 IP 159.203.43.128.ssh > bras-base-toroon0411w-grc-51-142-114-105-168.dsl.bell.ca.53164: Flags [P.], seq 288:500, ack 1, win 501, length 212
23:07:06.686104 IP 159.203.43.128.ssh > bras-base-toroon0411w-grc-51-142-114-105-168.dsl.bell.ca.53164: Flags [P.], seq 500:536, ack 1, win 501, length 36
23:07:06.686156 IP 159.203.43.128.ssh > bras-base-toroon0411w-grc-51-142-114-105-168.dsl.bell.ca.53164: Flags [P.], seq 536:724, ack 1, win 501, length 188
23:07:06.686199 IP 159.203.43.128.ssh > bras-base-toroon0411w-grc-51-142-114-105-168.dsl.bell.ca.53164: Flags [P.], seq 724:760, ack 1, win 501, length 36
23:07:06.686260 IP 159.203.43.128.ssh > bras-base-toroon0411w-grc-51-142-114-105-168.dsl.bell.ca.53164: Flags [P.], seq 760:956, ack 1, win 501, length 196
23:07:06.686303 IP 159.203.43.128.ssh > bras-base-toroon0411w-grc-51-142-114-105-168.dsl.bell.ca.53164: Flags [P.], seq 956:992, ack 1, win 501, length 36
23:07:06.686349 IP 159.203.43.128.ssh > bras-base-toroon0411w-grc-51-142-114-105-168.dsl.bell.ca.53164: Flags [P.], seq 992:1180, ack 1, win 501, length 188
23:07:06.686390 IP 159.203.43.128.ssh > bras-base-toroon0411w-grc-51-142-114-105-168.dsl.bell.ca.53164: Flags [P.], seq 1180:1216, ack 1, win 501, length 36
23:07:06.686441 IP 159.203.43.128.ssh > bras-base-toroon0411w-grc-51-142-114-105-168.dsl.bell.ca.53164: Flags [P.], seq 1216:1396, ack 1, win 501, length 180
23:07:06.686500 IP 159.203.43.128.ssh > bras-base-toroon0411w-grc-51-142-114-105-168.dsl.bell.ca.53164: Flags [P.], seq 1396:1612, ack 1, win 501, length 216
23:07:06.688197 IP bras-base-toroon0411w-grc-51-142-114-105-168.dsl.bell.ca.53164 > 159.203.43.128.ssh: Flags [.], ack 1612, win 1026, length 0
23:07:06.688239 IP 159.203.43.128.ssh > bras-base-toroon0411w-grc-51-142-114-105-168.dsl.bell.ca.53164: Flags [P.], seq 1612:3944, ack 1, win 501, length 2332
23:07:06.688342 IP 159.203.43.128.ssh > bras-base-toroon0411w-grc-51-142-114-105-168.dsl.bell.ca.53164: Flags [P.], seq 3944:4124, ack 1, win 501, length 180
23:07:06.688412 IP 159.203.43.128.ssh > bras-base-toroon0411w-grc-51-142-114-105-168.dsl.bell.ca.53164: Flags [P.], seq 4124:4160, ack 1, win 501, length 36
23:07:06.688478 IP 159.203.43.128.ssh > bras-base-toroon0411w-grc-51-142-114-105-168.dsl.bell.ca.53164: Flags [P.], seq 4160:4356, ack 1, win 501, length 196
23:07:06.688522 IP 159.203.43.128.ssh > bras-base-toroon0411w-grc-51-142-114-105-168.dsl.bell.ca.53164: Flags [P.], seq 4356:4392, ack 1, win 501, length 36
23:07:06.688581 IP 159.203.43.128.ssh > bras-base-toroon0411w-grc-51-142-114-105-168.dsl.bell.ca.53164: Flags [P.], seq 4392:4588, ack 1, win 501, length 196
23:07:06.688636 IP 159.203.43.128.ssh > bras-base-toroon0411w-grc-51-142-114-105-168.dsl.bell.ca.53164: Flags [P.], seq 4588:4624, ack 1, win 501, length 36
23:07:06.688706 IP 159.203.43.128.ssh > bras-base-toroon0411w-grc-51-142-114-105-168.dsl.bell.ca.53164: Flags [P.], seq 4624:4820, ack 1, win 501, length 196
23:07:06.688751 IP 159.203.43.128.ssh > bras-base-toroon0411w-grc-51-142-114-105-168.dsl.bell.ca.53164: Flags [P.], seq 4820:4856, ack 1, win 501, length 36
23:07:06.688809 IP 159.203.43.128.ssh > bras-base-toroon0411w-grc-51-142-114-105-168.dsl.bell.ca.53164: Flags [P.], seq 4856:5052, ack 1, win 501, length 196
23:07:06.688854 IP 159.203.43.128.ssh > bras-base-toroon0411w-grc-51-142-114-105-168.dsl.bell.ca.53164: Flags [P.], seq 5052:5088, ack 1, win 501, length 36
23:07:06.688910 IP 159.203.43.128.ssh > bras-base-toroon0411w-grc-51-142-114-105-168.dsl.bell.ca.53164: Flags [P.], seq 5088:5284, ack 1, win 501, length 196
23:07:06.688954 IP 159.203.43.128.ssh > bras-base-toroon0411w-grc-51-142-114-105-168.dsl.bell.ca.53164: Flags [P.], seq 5284:5320, ack 1, win 501, length 36
23:07:06.689012 IP 159.203.43.128.ssh > bras-base-toroon0411w-grc-51-142-114-105-168.dsl.bell.ca.53164: Flags [P.], seq 5320:5516, ack 1, win 501, length 196
23:07:06.689053 IP 159.203.43.128.ssh > bras-base-toroon0411w-grc-51-142-114-105-168.dsl.bell.ca.53164: Flags [P.], seq 5516:5552, ack 1, win 501, length 36
23:07:06.689110 IP 159.203.43.128.ssh > bras-base-toroon0411w-grc-51-142-114-105-168.dsl.bell.ca.53164: Flags [P.], seq 5552:5748, ack 1, win 501, length 196
23:07:06.689150 IP 159.203.43.128.ssh > bras-base-toroon0411w-grc-51-142-114-105-168.dsl.bell.ca.53164: Flags [P.], seq 5748:5784, ack 1, win 501, length 36
23:07:06.689207 IP 159.203.43.128.ssh > bras-base-toroon0411w-grc-51-142-114-105-168.dsl.bell.ca.53164: Flags [P.], seq 5784:5980, ack 1, win 501, length 196
23:07:06.689247 IP 159.203.43.128.ssh > bras-base-toroon0411w-grc-51-142-114-105-168.dsl.bell.ca.53164: Flags [P.], seq 5980:6016, ack 1, win 501, length 36
23:07:06.689763 IP bras-base-toroon0411w-grc-51-142-114-105-168.dsl.bell.ca.53164 > 159.203.43.128.ssh: Flags [.], ack 1612, win 1026, options [nop,nop,sack 1 {3064:3944}], length 0
23:07:06.689763 IP bras-base-toroon0411w-grc-51-142-114-105-168.dsl.bell.ca.53164 > 159.203.43.128.ssh: Flags [.], ack 3944, win 1026, length 0
23:07:06.689763 IP bras-base-toroon0411w-grc-51-142-114-105-168.dsl.bell.ca.53164 > 159.203.43.128.ssh: Flags [.], ack 4160, win 1025, length 0
23:07:06.689788 IP 159.203.43.128.ssh > bras-base-toroon0411w-grc-51-142-114-105-168.dsl.bell.ca.53164: Flags [.], seq 6016:7468, ack 1, win 501, length 1452
23:07:06.689803 IP 159.203.43.128.ssh > bras-base-toroon0411w-grc-51-142-114-105-168.dsl.bell.ca.53164: Flags [P.], seq 7468:8300, ack 1, win 501, length 832
23:07:06.689824 IP 159.203.43.128.ssh > bras-base-toroon0411w-grc-51-142-114-105-168.dsl.bell.ca.53164: Flags [P.], seq 8300:8336, ack 1, win 501, length 36
23:07:06.689886 IP 159.203.43.128.ssh > bras-base-toroon0411w-grc-51-142-114-105-168.dsl.bell.ca.53164: Flags [P.], seq 8336:8532, ack 1, win 501, length 196
23:07:06.689940 IP 159.203.43.128.ssh > bras-base-toroon0411w-grc-51-142-114-105-168.dsl.bell.ca.53164: Flags [P.], seq 8532:8568, ack 1, win 501, length 36
23:07:06.689994 IP bras-base-toroon0411w-grc-51-142-114-105-168.dsl.bell.ca.53164 > 159.203.43.128.ssh: Flags [P.], seq 1:37, ack 4160, win 1025, length 36
23:07:06.689995 IP bras-base-toroon0411w-grc-51-142-114-105-168.dsl.bell.ca.53164 > 159.203.43.128.ssh: Flags [.], ack 4624, win 1023, length 0
23:07:06.690042 IP 159.203.43.128.ssh > bras-base-toroon0411w-grc-51-142-114-105-168.dsl.bell.ca.53164: Flags [P.], seq 8568:8788, ack 37, win 501, length 220
23:07:06.690085 IP 159.203.43.128.ssh > bras-base-toroon0411w-grc-51-142-114-105-168.dsl.bell.ca.53164: Flags [P.], seq 8788:8824, ack 37, win 501, length 36
23:07:06.690137 IP 159.203.43.128.ssh > bras-base-toroon0411w-grc-51-142-114-105-168.dsl.bell.ca.53164: Flags [P.], seq 8824:9004, ack 37, win 501, length 180
23:07:06.690190 IP 159.203.43.128.ssh > bras-base-toroon0411w-grc-51-142-114-105-168.dsl.bell.ca.53164: Flags [P.], seq 9004:9040, ack 37, win 501, length 36
23:07:06.690241 IP bras-base-toroon0411w-grc-51-142-114-105-168.dsl.bell.ca.53164 > 159.203.43.128.ssh: Flags [.], ack 5284, win 1021, length 0
23:07:06.690261 IP 159.203.43.128.ssh > bras-base-toroon0411w-grc-51-142-114-105-168.dsl.bell.ca.53164: Flags [P.], seq 9040:9220, ack 37, win 501, length 180
23:07:06.690301 IP 159.203.43.128.ssh > bras-base-toroon0411w-grc-51-142-114-105-168.dsl.bell.ca.53164: Flags [P.], seq 9220:9256, ack 37, win 501, length 36
23:07:06.690350 IP 159.203.43.128.ssh > bras-base-toroon0411w-grc-51-142-114-105-168.dsl.bell.ca.53164: Flags [P.], seq 9256:9452, ack 37, win 501, length 196
23:07:06.690388 IP 159.203.43.128.ssh > bras-base-toroon0411w-grc-51-142-114-105-168.dsl.bell.ca.53164: Flags [P.], seq 9452:9488, ack 37, win 501, length 36
23:07:06.690435 IP 159.203.43.128.ssh > bras-base-toroon0411w-grc-51-142-114-105-168.dsl.bell.ca.53164: Flags [P.], seq 9488:9684, ack 37, win 501, length 196
23:07:06.690472 IP 159.203.43.128.ssh > bras-base-toroon0411w-grc-51-142-114-105-168.dsl.bell.ca.53164: Flags [P.], seq 9684:9720, ack 37, win 501, length 36
23:07:06.690518 IP 159.203.43.128.ssh > bras-base-toroon0411w-grc-51-142-114-105-168.dsl.bell.ca.53164: Flags [P.], seq 9720:9916, ack 37, win 501, length 196
23:07:06.690557 IP 159.203.43.128.ssh > bras-base-toroon0411w-grc-51-142-114-105-168.dsl.bell.ca.53164: Flags [P.], seq 9916:9952, ack 37, win 501, length 36
23:07:06.690613 IP 159.203.43.128.ssh > bras-base-toroon0411w-grc-51-142-114-105-168.dsl.bell.ca.53164: Flags [P.], seq 9952:10148, ack 37, win 501, length 196
23:07:06.690651 IP 159.203.43.128.ssh > bras-base-toroon0411w-grc-51-142-114-105-168.dsl.bell.ca.53164: Flags [P.], seq 10148:10184, ack 37, win 501, length 36
23:07:06.690701 IP 159.203.43.128.ssh > bras-base-toroon0411w-grc-51-142-114-105-168.dsl.bell.ca.53164: Flags [P.], seq 10184:10380, ack 37, win 501, length 196
23:07:06.690738 IP 159.203.43.128.ssh > bras-base-toroon0411w-grc-51-142-114-105-168.dsl.bell.ca.53164: Flags [P.], seq 10380:10416, ack 37, win 501, length 36
23:07:06.690785 IP 159.203.43.128.ssh > bras-base-toroon0411w-grc-51-142-114-105-168.dsl.bell.ca.53164: Flags [P.], seq 10416:10612, ack 37, win 501, length 196
23:07:06.690823 IP 159.203.43.128.ssh > bras-base-toroon0411w-grc-51-142-114-105-168.dsl.bell.ca.53164: Flags [P.], seq 10612:10648, ack 37, win 501, length 36
23:07:06.690869 IP 159.203.43.128.ssh > bras-base-toroon0411w-grc-51-142-114-105-168.dsl.bell.ca.53164: Flags [P.], seq 10648:10828, ack 37, win 501, length 180
23:07:06.690909 IP 159.203.43.128.ssh > bras-base-toroon0411w-grc-51-142-114-105-168.dsl.bell.ca.53164: Flags [P.], seq 10828:10864, ack 37, win 501, length 36
23:07:06.693546 IP bras-base-toroon0411w-grc-51-142-114-105-168.dsl.bell.ca.53164 > 159.203.43.128.ssh: Flags [.], ack 6016, win 1026, options [nop,nop,sack 1 {7468:8300}], length 0
23:07:06.693546 IP bras-base-toroon0411w-grc-51-142-114-105-168.dsl.bell.ca.53164 > 159.203.43.128.ssh: Flags [.], ack 8300, win 1026, length 0
23:07:06.693594 IP 159.203.43.128.ssh > bras-base-toroon0411w-grc-51-142-114-105-168.dsl.bell.ca.53164: Flags [P.], seq 10864:15720, ack 37, win 501, length 4856
23:07:06.693730 IP 159.203.43.128.ssh > bras-base-toroon0411w-grc-51-142-114-105-168.dsl.bell.ca.53164: Flags [P.], seq 15720:15940, ack 37, win 501, length 220
23:07:06.693805 IP 159.203.43.128.ssh > bras-base-toroon0411w-grc-51-142-114-105-168.dsl.bell.ca.53164: Flags [P.], seq 15940:15976, ack 37, win 501, length 36
23:07:06.693892 IP 159.203.43.128.ssh > bras-base-toroon0411w-grc-51-142-114-105-168.dsl.bell.ca.53164: Flags [P.], seq 15976:16156, ack 37, win 501, length 180
23:07:06.693955 IP 159.203.43.128.ssh > bras-base-toroon0411w-grc-51-142-114-105-168.dsl.bell.ca.53164: Flags [P.], seq 16156:16192, ack 37, win 501, length 36
23:07:06.694035 IP 159.203.43.128.ssh > bras-base-toroon0411w-grc-51-142-114-105-168.dsl.bell.ca.53164: Flags [P.], seq 16192:16388, ack 37, win 501, length 196
23:07:06.694094 IP 159.203.43.128.ssh > bras-base-toroon0411w-grc-51-142-114-105-168.dsl.bell.ca.53164: Flags [P.], seq 16388:16424, ack 37, win 501, length 36
23:07:06.694170 IP 159.203.43.128.ssh > bras-base-toroon0411w-grc-51-142-114-105-168.dsl.bell.ca.53164: Flags [P.], seq 16424:16620, ack 37, win 501, length 196
23:07:06.694230 IP 159.203.43.128.ssh > bras-base-toroon0411w-grc-51-142-114-105-168.dsl.bell.ca.53164: Flags [P.], seq 16620:16656, ack 37, win 501, length 36
23:07:06.694302 IP 159.203.43.128.ssh > bras-base-toroon0411w-grc-51-142-114-105-168.dsl.bell.ca.53164: Flags [P.], seq 16656:16852, ack 37, win 501, length 196
23:07:06.694363 IP 159.203.43.128.ssh > bras-base-toroon0411w-grc-51-142-114-105-168.dsl.bell.ca.53164: Flags [P.], seq 16852:16888, ack 37, win 501, length 36
23:07:06.694437 IP 159.203.43.128.ssh > bras-base-toroon0411w-grc-51-142-114-105-168.dsl.bell.ca.53164: Flags [P.], seq 16888:17084, ack 37, win 501, length 196
23:07:06.694497 IP 159.203.43.128.ssh > bras-base-toroon0411w-grc-51-142-114-105-168.dsl.bell.ca.53164: Flags [P.], seq 17084:17120, ack 37, win 501, length 36
23:07:06.694597 IP 159.203.43.128.ssh > bras-base-toroon0411w-grc-51-142-114-105-168.dsl.bell.ca.53164: Flags [P.], seq 17120:17316, ack 37, win 501, length 196
23:07:06.694634 IP bras-base-toroon0411w-grc-51-142-114-105-168.dsl.bell.ca.53164 > 159.203.43.128.ssh: Flags [.], ack 9488, win 1021, length 0
23:07:06.694693 IP 159.203.43.128.ssh > bras-base-toroon0411w-grc-51-142-114-105-168.dsl.bell.ca.53164: Flags [P.], seq 17316:17352, ack 37, win 501, length 36
23:07:06.694776 IP 159.203.43.128.ssh > bras-base-toroon0411w-grc-51-142-114-105-168.dsl.bell.ca.53164: Flags [P.], seq 17352:17548, ack 37, win 501, length 196
23:07:06.694860 IP 159.203.43.128.ssh > bras-base-toroon0411w-grc-51-142-114-105-168.dsl.bell.ca.53164: Flags [P.], seq 17548:17584, ack 37, win 501, length 36
23:07:06.694924 IP 159.203.43.128.ssh > bras-base-toroon0411w-grc-51-142-114-105-168.dsl.bell.ca.53164: Flags [P.], seq 17584:17780, ack 37, win 501, length 196
23:07:06.695006 IP 159.203.43.128.ssh > bras-base-toroon0411w-grc-51-142-114-105-168.dsl.bell.ca.53164: Flags [P.], seq 17780:17816, ack 37, win 501, length 36
23:07:06.695065 IP 159.203.43.128.ssh > bras-base-toroon0411w-grc-51-142-114-105-168.dsl.bell.ca.53164: Flags [P.], seq 17816:18012, ack 37, win 501, length 196
23:07:06.695129 IP bras-base-toroon0411w-grc-51-142-114-105-168.dsl.bell.ca.53164 > 159.203.43.128.ssh: Flags [.], ack 10648, win 1026, length 0
23:07:06.695129 IP bras-base-toroon0411w-grc-51-142-114-105-168.dsl.bell.ca.53164 > 159.203.43.128.ssh: Flags [.], ack 12316, win 1026, options [nop,nop,sack 1 {13768:15220}], length 0
23:07:06.695129 IP bras-base-toroon0411w-grc-51-142-114-105-168.dsl.bell.ca.53164 > 159.203.43.128.ssh: Flags [.], ack 15220, win 1026, length 0
23:07:06.695172 IP 159.203.43.128.ssh > bras-base-toroon0411w-grc-51-142-114-105-168.dsl.bell.ca.53164: Flags [P.], seq 18012:18048, ack 37, win 501, length 36
23:07:06.695242 IP bras-base-toroon0411w-grc-51-142-114-105-168.dsl.bell.ca.53164 > 159.203.43.128.ssh: Flags [.], ack 15976, win 1023, length 0
23:07:06.695277 IP 159.203.43.128.ssh > bras-base-toroon0411w-grc-51-142-114-105-168.dsl.bell.ca.53164: Flags [P.], seq 18048:18244, ack 37, win 501, length 196
23:07:06.695337 IP 159.203.43.128.ssh > bras-base-toroon0411w-grc-51-142-114-105-168.dsl.bell.ca.53164: Flags [P.], seq 18244:18280, ack 37, win 501, length 36
23:07:06.695417 IP 159.203.43.128.ssh > bras-base-toroon0411w-grc-51-142-114-105-168.dsl.bell.ca.53164: Flags [P.], seq 18280:18476, ack 37, win 501, length 196
23:07:06.695480 IP 159.203.43.128.ssh > bras-base-toroon0411w-grc-51-142-114-105-168.dsl.bell.ca.53164: Flags [P.], seq 18476:18512, ack 37, win 501, length 36
23:07:06.695555 IP 159.203.43.128.ssh > bras-base-toroon0411w-grc-51-142-114-105-168.dsl.bell.ca.53164: Flags [P.], seq 18512:18708, ack 37, win 501, length 196
23:07:06.695615 IP 159.203.43.128.ssh > bras-base-toroon0411w-grc-51-142-114-105-168.dsl.bell.ca.53164: Flags [P.], seq 18708:18744, ack 37, win 501, length 36
23:07:06.695695 IP 159.203.43.128.ssh > bras-base-toroon0411w-grc-51-142-114-105-168.dsl.bell.ca.53164: Flags [P.], seq 18744:18940, ack 37, win 501, length 196
23:07:06.695779 IP bras-base-toroon0411w-grc-51-142-114-105-168.dsl.bell.ca.53164 > 159.203.43.128.ssh: Flags [.], ack 16424, win 1021, length 0
23:07:06.695780 IP bras-base-toroon0411w-grc-51-142-114-105-168.dsl.bell.ca.53164 > 159.203.43.128.ssh: Flags [.], ack 16888, win 1026, length 0
23:07:06.695797 IP 159.203.43.128.ssh > bras-base-toroon0411w-grc-51-142-114-105-168.dsl.bell.ca.53164: Flags [P.], seq 18940:18976, ack 37, win 501, length 36
23:07:06.695876 IP 159.203.43.128.ssh > bras-base-toroon0411w-grc-51-142-114-105-168.dsl.bell.ca.53164: Flags [P.], seq 18976:19172, ack 37, win 501, length 196
23:07:06.695938 IP 159.203.43.128.ssh > bras-base-toroon0411w-grc-51-142-114-105-168.dsl.bell.ca.53164: Flags [P.], seq 19172:19208, ack 37, win 501, length 36
23:07:06.696003 IP bras-base-toroon0411w-grc-51-142-114-105-168.dsl.bell.ca.53164 > 159.203.43.128.ssh: Flags [.], ack 17316, win 1024, length 0
23:07:06.696039 IP 159.203.43.128.ssh > bras-base-toroon0411w-grc-51-142-114-105-168.dsl.bell.ca.53164: Flags [P.], seq 19208:19404, ack 37, win 501, length 196
23:07:06.696102 IP 159.203.43.128.ssh > bras-base-toroon0411w-grc-51-142-114-105-168.dsl.bell.ca.53164: Flags [P.], seq 19404:19440, ack 37, win 501, length 36
23:07:06.696223 IP 159.203.43.128.ssh > bras-base-toroon0411w-grc-51-142-114-105-168.dsl.bell.ca.53164: Flags [P.], seq 19440:19620, ack 37, win 501, length 180
23:07:06.696299 IP 159.203.43.128.ssh > bras-base-toroon0411w-grc-51-142-114-105-168.dsl.bell.ca.53164: Flags [P.], seq 19620:19656, ack 37, win 501, length 36
23:07:06.696389 IP 159.203.43.128.ssh > bras-base-toroon0411w-grc-51-142-114-105-168.dsl.bell.ca.53164: Flags [P.], seq 19656:19852, ack 37, win 501, length 196
23:07:06.696453 IP 159.203.43.128.ssh > bras-base-toroon0411w-grc-51-142-114-105-168.dsl.bell.ca.53164: Flags [P.], seq 19852:19888, ack 37, win 501, length 36
23:07:06.696538 IP 159.203.43.128.ssh > bras-base-toroon0411w-grc-51-142-114-105-168.dsl.bell.ca.53164: Flags [P.], seq 19888:20084, ack 37, win 501, length 196
23:07:06.696599 IP 159.203.43.128.ssh > bras-base-toroon0411w-grc-51-142-114-105-168.dsl.bell.ca.53164: Flags [P.], seq 20084:20120, ack 37, win 501, length 36
23:07:06.696617 IP bras-base-toroon0411w-grc-51-142-114-105-168.dsl.bell.ca.53164 > 159.203.43.128.ssh: Flags [.], ack 17816, win 1022, length 0
23:07:06.696742 IP 159.203.43.128.ssh > bras-base-toroon0411w-grc-51-142-114-105-168.dsl.bell.ca.53164: Flags [P.], seq 20120:20804, ack 37, win 501, length 684
23:07:06.696862 IP 159.203.43.128.ssh > bras-base-toroon0411w-grc-51-142-114-105-168.dsl.bell.ca.53164: Flags [P.], seq 20804:21176, ack 37, win 501, length 372
23:07:06.696995 IP bras-base-toroon0411w-grc-51-142-114-105-168.dsl.bell.ca.53164 > 159.203.43.128.ssh: Flags [.], ack 18012, win 1022, length 0
23:07:06.696996 IP bras-base-toroon0411w-grc-51-142-114-105-168.dsl.bell.ca.53164 > 159.203.43.128.ssh: Flags [.], ack 18744, win 1026, length 0
23:07:06.697026 IP 159.203.43.128.ssh > bras-base-toroon0411w-grc-51-142-114-105-168.dsl.bell.ca.53164: Flags [P.], seq 21176:21828, ack 37, win 501, length 652
23:07:06.697271 IP bras-base-toroon0411w-grc-51-142-114-105-168.dsl.bell.ca.53164 > 159.203.43.128.ssh: Flags [.], ack 19172, win 1024, length 0
23:07:06.697366 IP 159.203.43.128.ssh > bras-base-toroon0411w-grc-51-142-114-105-168.dsl.bell.ca.53164: Flags [P.], seq 21828:23448, ack 37, win 501, length 1620
23:07:06.697507 IP bras-base-toroon0411w-grc-51-142-114-105-168.dsl.bell.ca.53164 > 159.203.43.128.ssh: Flags [.], ack 19440, win 1023, length 0
23:07:06.697737 IP 159.203.43.128.ssh > bras-base-toroon0411w-grc-51-142-114-105-168.dsl.bell.ca.53164: Flags [P.], seq 23448:26012, ack 37, win 501, length 2564
23:07:06.697917 IP 159.203.43.128.ssh > bras-base-toroon0411w-grc-51-142-114-105-168.dsl.bell.ca.53164: Flags [P.], seq 26012:26672, ack 37, win 501, length 660
23:07:06.698001 IP bras-base-toroon0411w-grc-51-142-114-105-168.dsl.bell.ca.53164 > 159.203.43.128.ssh: Flags [.], ack 19852, win 1022, length 0
23:07:06.698039 IP 159.203.43.128.ssh > bras-base-toroon0411w-grc-51-142-114-105-168.dsl.bell.ca.53164: Flags [P.], seq 26672:26868, ack 37, win 501, length 196
23:07:06.698117 IP bras-base-toroon0411w-grc-51-142-114-105-168.dsl.bell.ca.53164 > 159.203.43.128.ssh: Flags [.], ack 20120, win 1021, length 0
23:07:06.698203 IP 159.203.43.128.ssh > bras-base-toroon0411w-grc-51-142-114-105-168.dsl.bell.ca.53164: Flags [P.], seq 26868:27360, ack 37, win 501, length 492
23:07:06.698303 IP 159.203.43.128.ssh > bras-base-toroon0411w-grc-51-142-114-105-168.dsl.bell.ca.53164: Flags [P.], seq 27360:27556, ack 37, win 501, length 196
23:07:06.698364 IP bras-base-toroon0411w-grc-51-142-114-105-168.dsl.bell.ca.53164 > 159.203.43.128.ssh: Flags [.], ack 21176, win 1026, length 0
23:07:06.698440 IP 159.203.43.128.ssh > bras-base-toroon0411w-grc-51-142-114-105-168.dsl.bell.ca.53164: Flags [P.], seq 27556:27904, ack 37, win 501, length 348
23:07:06.698537 IP 159.203.43.128.ssh > bras-base-toroon0411w-grc-51-142-114-105-168.dsl.bell.ca.53164: Flags [P.], seq 27904:28100, ack 37, win 501, length 196
23:07:06.698629 IP 159.203.43.128.ssh > bras-base-toroon0411w-grc-51-142-114-105-168.dsl.bell.ca.53164: Flags [P.], seq 28100:28296, ack 37, win 501, length 196
23:07:06.698721 IP 159.203.43.128.ssh > bras-base-toroon0411w-grc-51-142-114-105-168.dsl.bell.ca.53164: Flags [P.], seq 28296:28492, ack 37, win 501, length 196
23:07:06.698812 IP 159.203.43.128.ssh > bras-base-toroon0411w-grc-51-142-114-105-168.dsl.bell.ca.53164: Flags [P.], seq 28492:28688, ack 37, win 501, length 196
23:07:06.698904 IP 159.203.43.128.ssh > bras-base-toroon0411w-grc-51-142-114-105-168.dsl.bell.ca.53164: Flags [P.], seq 28688:28884, ack 37, win 501, length 196
23:07:06.698993 IP 159.203.43.128.ssh > bras-base-toroon0411w-grc-51-142-114-105-168.dsl.bell.ca.53164: Flags [P.], seq 28884:29080, ack 37, win 501, length 196
23:07:06.699087 IP 159.203.43.128.ssh > bras-base-toroon0411w-grc-51-142-114-105-168.dsl.bell.ca.53164: Flags [P.], seq 29080:29276, ack 37, win 501, length 196
23:07:06.699151 IP bras-base-toroon0411w-grc-51-142-114-105-168.dsl.bell.ca.53164 > 159.203.43.128.ssh: Flags [.], ack 21828, win 1024, options [nop,nop,sack 1 {23280:23448}], length 0
23:07:06.699248 IP bras-base-toroon0411w-grc-51-142-114-105-168.dsl.bell.ca.53164 > 159.203.43.128.ssh: Flags [.], ack 23448, win 1026, length 0
23:07:06.699284 IP 159.203.43.128.ssh > bras-base-toroon0411w-grc-51-142-114-105-168.dsl.bell.ca.53164: Flags [P.], seq 29276:29664, ack 37, win 501, length 388
23:07:06.699395 IP 159.203.43.128.ssh > bras-base-toroon0411w-grc-51-142-114-105-168.dsl.bell.ca.53164: Flags [P.], seq 29664:30012, ack 37, win 501, length 348
23:07:06.699490 IP 159.203.43.128.ssh > bras-base-toroon0411w-grc-51-142-114-105-168.dsl.bell.ca.53164: Flags [P.], seq 30012:30208, ack 37, win 501, length 196
23:07:06.699581 IP 159.203.43.128.ssh > bras-base-toroon0411w-grc-51-142-114-105-168.dsl.bell.ca.53164: Flags [P.], seq 30208:30404, ack 37, win 501, length 196
23:07:06.699671 IP 159.203.43.128.ssh > bras-base-toroon0411w-grc-51-142-114-105-168.dsl.bell.ca.53164: Flags [P.], seq 30404:30600, ack 37, win 501, length 196
23:07:06.699767 IP 159.203.43.128.ssh > bras-base-toroon0411w-grc-51-142-114-105-168.dsl.bell.ca.53164: Flags [P.], seq 30600:30796, ack 37, win 501, length 196
23:07:06.699859 IP 159.203.43.128.ssh > bras-base-toroon0411w-grc-51-142-114-105-168.dsl.bell.ca.53164: Flags [P.], seq 30796:30992, ack 37, win 501, length 196
23:07:06.699949 IP 159.203.43.128.ssh > bras-base-toroon0411w-grc-51-142-114-105-168.dsl.bell.ca.53164: Flags [P.], seq 30992:31188, ack 37, win 501, length 196
23:07:06.700039 IP 159.203.43.128.ssh > bras-base-toroon0411w-grc-51-142-114-105-168.dsl.bell.ca.53164: Flags [P.], seq 31188:31384, ack 37, win 501, length 196
23:07:06.700179 IP 159.203.43.128.ssh > bras-base-toroon0411w-grc-51-142-114-105-168.dsl.bell.ca.53164: Flags [P.], seq 31384:31580, ack 37, win 501, length 196
23:07:06.700247 IP bras-base-toroon0411w-grc-51-142-114-105-168.dsl.bell.ca.53164 > 159.203.43.128.ssh: Flags [.], ack 28296, win 1026, length 0
23:07:06.700327 IP 159.203.43.128.ssh > bras-base-toroon0411w-grc-51-142-114-105-168.dsl.bell.ca.53164: Flags [P.], seq 31580:31928, ack 37, win 501, length 348
23:07:06.700420 IP 159.203.43.128.ssh > bras-base-toroon0411w-grc-51-142-114-105-168.dsl.bell.ca.53164: Flags [P.], seq 31928:32124, ack 37, win 501, length 196
23:07:06.700509 IP 159.203.43.128.ssh > bras-base-toroon0411w-grc-51-142-114-105-168.dsl.bell.ca.53164: Flags [P.], seq 32124:32320, ack 37, win 501, length 196
23:07:06.700682 IP 159.203.43.128.ssh > bras-base-toroon0411w-grc-51-142-114-105-168.dsl.bell.ca.53164: Flags [P.], seq 32320:32516, ack 37, win 501, length 196
23:07:06.700779 IP 159.203.43.128.ssh > bras-base-toroon0411w-grc-51-142-114-105-168.dsl.bell.ca.53164: Flags [P.], seq 32516:32712, ack 37, win 501, length 196
23:07:06.700866 IP 159.203.43.128.ssh > bras-base-toroon0411w-grc-51-142-114-105-168.dsl.bell.ca.53164: Flags [P.], seq 32712:32908, ack 37, win 501, length 196
23:07:06.700982 IP 159.203.43.128.ssh > bras-base-toroon0411w-grc-51-142-114-105-168.dsl.bell.ca.53164: Flags [P.], seq 32908:33104, ack 37, win 501, length 196
23:07:06.701076 IP 159.203.43.128.ssh > bras-base-toroon0411w-grc-51-142-114-105-168.dsl.bell.ca.53164: Flags [P.], seq 33104:33300, ack 37, win 501, length 196
23:07:06.701165 IP 159.203.43.128.ssh > bras-base-toroon0411w-grc-51-142-114-105-168.dsl.bell.ca.53164: Flags [P.], seq 33300:33496, ack 37, win 501, length 196
23:07:06.701247 IP bras-base-toroon0411w-grc-51-142-114-105-168.dsl.bell.ca.53164 > 159.203.43.128.ssh: Flags [.], ack 30600, win 1026, length 0
23:07:06.701287 IP 159.203.43.128.ssh > bras-base-toroon0411w-grc-51-142-114-105-168.dsl.bell.ca.53164: Flags [P.], seq 33496:33692, ack 37, win 501, length 196
23:07:06.701419 IP 159.203.43.128.ssh > bras-base-toroon0411w-grc-51-142-114-105-168.dsl.bell.ca.53164: Flags [P.], seq 33692:34040, ack 37, win 501, length 348
23:07:06.701547 IP 159.203.43.128.ssh > bras-base-toroon0411w-grc-51-142-114-105-168.dsl.bell.ca.53164: Flags [P.], seq 34040:34236, ack 37, win 501, length 196
23:07:06.701631 IP bras-base-toroon0411w-grc-51-142-114-105-168.dsl.bell.ca.53164 > 159.203.43.128.ssh: Flags [.], ack 31580, win 1022, length 0
23:07:06.701674 IP 159.203.43.128.ssh > bras-base-toroon0411w-grc-51-142-114-105-168.dsl.bell.ca.53164: Flags [P.], seq 34236:34432, ack 37, win 501, length 196
23:07:06.701784 IP 159.203.43.128.ssh > bras-base-toroon0411w-grc-51-142-114-105-168.dsl.bell.ca.53164: Flags [P.], seq 34432:34780, ack 37, win 501, length 348
23:07:06.701874 IP bras-base-toroon0411w-grc-51-142-114-105-168.dsl.bell.ca.53164 > 159.203.43.128.ssh: Flags [.], ack 32124, win 1026, length 0
23:07:06.701917 IP 159.203.43.128.ssh > bras-base-toroon0411w-grc-51-142-114-105-168.dsl.bell.ca.53164: Flags [P.], seq 34780:34976, ack 37, win 501, length 196
23:07:06.702068 IP 159.203.43.128.ssh > bras-base-toroon0411w-grc-51-142-114-105-168.dsl.bell.ca.53164: Flags [P.], seq 34976:35324, ack 37, win 501, length 348
23:07:06.702165 IP 159.203.43.128.ssh > bras-base-toroon0411w-grc-51-142-114-105-168.dsl.bell.ca.53164: Flags [P.], seq 35324:35520, ack 37, win 501, length 196
23:07:06.702265 IP bras-base-toroon0411w-grc-51-142-114-105-168.dsl.bell.ca.53164 > 159.203.43.128.ssh: Flags [.], ack 32516, win 1025, length 0
23:07:06.702298 IP 159.203.43.128.ssh > bras-base-toroon0411w-grc-51-142-114-105-168.dsl.bell.ca.53164: Flags [P.], seq 35520:35716, ack 37, win 501, length 196
23:07:06.702365 IP bras-base-toroon0411w-grc-51-142-114-105-168.dsl.bell.ca.53164 > 159.203.43.128.ssh: Flags [.], ack 32908, win 1023, length 0
23:07:06.702462 IP 159.203.43.128.ssh > bras-base-toroon0411w-grc-51-142-114-105-168.dsl.bell.ca.53164: Flags [P.], seq 35716:36208, ack 37, win 501, length 492
23:07:06.702550 IP 159.203.43.128.ssh > bras-base-toroon0411w-grc-51-142-114-105-168.dsl.bell.ca.53164: Flags [P.], seq 36208:36404, ack 37, win 501, length 196
23:07:06.702673 IP 159.203.43.128.ssh > bras-base-toroon0411w-grc-51-142-114-105-168.dsl.bell.ca.53164: Flags [P.], seq 36404:36600, ack 37, win 501, length 196
23:07:06.702760 IP 159.203.43.128.ssh > bras-base-toroon0411w-grc-51-142-114-105-168.dsl.bell.ca.53164: Flags [P.], seq 36600:36796, ack 37, win 501, length 196
23:07:06.702846 IP 159.203.43.128.ssh > bras-base-toroon0411w-grc-51-142-114-105-168.dsl.bell.ca.53164: Flags [P.], seq 36796:36992, ack 37, win 501, length 196
23:07:06.702873 IP bras-base-toroon0411w-grc-51-142-114-105-168.dsl.bell.ca.53164 > 159.203.43.128.ssh: Flags [.], ack 33496, win 1021, length 0
23:07:06.702975 IP 159.203.43.128.ssh > bras-base-toroon0411w-grc-51-142-114-105-168.dsl.bell.ca.53164: Flags [P.], seq 36992:37340, ack 37, win 501, length 348
23:07:06.703065 IP 159.203.43.128.ssh > bras-base-toroon0411w-grc-51-142-114-105-168.dsl.bell.ca.53164: Flags [P.], seq 37340:37536, ack 37, win 501, length 196
23:07:06.703131 IP bras-base-toroon0411w-grc-51-142-114-105-168.dsl.bell.ca.53164 > 159.203.43.128.ssh: Flags [.], ack 33692, win 1026, length 0
23:07:06.703201 IP 159.203.43.128.ssh > bras-base-toroon0411w-grc-51-142-114-105-168.dsl.bell.ca.53164: Flags [P.], seq 37536:37884, ack 37, win 501, length 348
23:07:06.703291 IP 159.203.43.128.ssh > bras-base-toroon0411w-grc-51-142-114-105-168.dsl.bell.ca.53164: Flags [P.], seq 37884:38080, ack 37, win 501, length 196
23:07:06.703378 IP bras-base-toroon0411w-grc-51-142-114-105-168.dsl.bell.ca.53164 > 159.203.43.128.ssh: Flags [.], ack 34432, win 1023, length 0
23:07:06.703449 IP 159.203.43.128.ssh > bras-base-toroon0411w-grc-51-142-114-105-168.dsl.bell.ca.53164: Flags [P.], seq 38080:38428, ack 37, win 501, length 348
23:07:06.703542 IP 159.203.43.128.ssh > bras-base-toroon0411w-grc-51-142-114-105-168.dsl.bell.ca.53164: Flags [P.], seq 38428:38624, ack 37, win 501, length 196
23:07:06.703633 IP bras-base-toroon0411w-grc-51-142-114-105-168.dsl.bell.ca.53164 > 159.203.43.128.ssh: Flags [.], ack 34976, win 1021, length 0
23:07:06.703664 IP 159.203.43.128.ssh > bras-base-toroon0411w-grc-51-142-114-105-168.dsl.bell.ca.53164: Flags [P.], seq 38624:38820, ack 37, win 501, length 196
23:07:06.703772 IP 159.203.43.128.ssh > bras-base-toroon0411w-grc-51-142-114-105-168.dsl.bell.ca.53164: Flags [P.], seq 38820:39168, ack 37, win 501, length 348
23:07:06.703869 IP bras-base-toroon0411w-grc-51-142-114-105-168.dsl.bell.ca.53164 > 159.203.43.128.ssh: Flags [.], ack 35324, win 1026, length 0
23:07:06.703886 IP 159.203.43.128.ssh > bras-base-toroon0411w-grc-51-142-114-105-168.dsl.bell.ca.53164: Flags [P.], seq 39168:39364, ack 37, win 501, length 196
23:07:06.704015 IP 159.203.43.128.ssh > bras-base-toroon0411w-grc-51-142-114-105-168.dsl.bell.ca.53164: Flags [P.], seq 39364:39712, ack 37, win 501, length 348
23:07:06.704106 IP 159.203.43.128.ssh > bras-base-toroon0411w-grc-51-142-114-105-168.dsl.bell.ca.53164: Flags [P.], seq 39712:39908, ack 37, win 501, length 196
23:07:06.704237 IP bras-base-toroon0411w-grc-51-142-114-105-168.dsl.bell.ca.53164 > 159.203.43.128.ssh: Flags [.], ack 35716, win 1025, length 0
23:07:06.704369 IP 159.203.43.128.ssh > bras-base-toroon0411w-grc-51-142-114-105-168.dsl.bell.ca.53164: Flags [P.], seq 39908:40256, ack 37, win 501, length 348
23:07:06.704642 IP bras-base-toroon0411w-grc-51-142-114-105-168.dsl.bell.ca.53164 > 159.203.43.128.ssh: Flags [.], ack 36404, win 1022, length 0
23:07:06.704642 IP bras-base-toroon0411w-grc-51-142-114-105-168.dsl.bell.ca.53164 > 159.203.43.128.ssh: Flags [.], ack 36796, win 1026, length 0
23:07:06.704642 IP bras-base-toroon0411w-grc-51-142-114-105-168.dsl.bell.ca.53164 > 159.203.43.128.ssh: Flags [.], ack 37536, win 1023, length 0
23:07:06.704683 IP 159.203.43.128.ssh > bras-base-toroon0411w-grc-51-142-114-105-168.dsl.bell.ca.53164: Flags [P.], seq 40256:40452, ack 37, win 501, length 196
23:07:06.704869 IP bras-base-toroon0411w-grc-51-142-114-105-168.dsl.bell.ca.53164 > 159.203.43.128.ssh: Flags [.], ack 38080, win 1021, length 0
23:07:06.704933 IP 159.203.43.128.ssh > bras-base-toroon0411w-grc-51-142-114-105-168.dsl.bell.ca.53164: Flags [P.], seq 40452:41088, ack 37, win 501, length 636
23:07:06.705013 IP 159.203.43.128.ssh > bras-base-toroon0411w-grc-51-142-114-105-168.dsl.bell.ca.53164: Flags [P.], seq 41088:41268, ack 37, win 501, length 180
23:07:06.705086 IP 159.203.43.128.ssh > bras-base-toroon0411w-grc-51-142-114-105-168.dsl.bell.ca.53164: Flags [P.], seq 41268:41464, ack 37, win 501, length 196
23:07:06.705161 IP 159.203.43.128.ssh > bras-base-toroon0411w-grc-51-142-114-105-168.dsl.bell.ca.53164: Flags [P.], seq 41464:41660, ack 37, win 501, length 196
23:07:06.705187 IP bras-base-toroon0411w-grc-51-142-114-105-168.dsl.bell.ca.53164 > 159.203.43.128.ssh: Flags [.], ack 38624, win 1026, length 0
23:07:06.705264 IP 159.203.43.128.ssh > bras-base-toroon0411w-grc-51-142-114-105-168.dsl.bell.ca.53164: Flags [P.], seq 41660:41856, ack 37, win 501, length 196
23:07:06.705306 IP bras-base-toroon0411w-grc-51-142-114-105-168.dsl.bell.ca.53164 > 159.203.43.128.ssh: Flags [.], ack 38820, win 1025, length 0
23:07:06.705403 IP bras-base-toroon0411w-grc-51-142-114-105-168.dsl.bell.ca.53164 > 159.203.43.128.ssh: Flags [.], ack 39364, win 1023, length 0
23:07:06.705447 IP 159.203.43.128.ssh > bras-base-toroon0411w-grc-51-142-114-105-168.dsl.bell.ca.53164: Flags [P.], seq 41856:42204, ack 37, win 501, length 348
23:07:06.705523 IP 159.203.43.128.ssh > bras-base-toroon0411w-grc-51-142-114-105-168.dsl.bell.ca.53164: Flags [P.], seq 42204:42552, ack 37, win 501, length 348
23:07:06.705562 IP 159.203.43.128.ssh > bras-base-toroon0411w-grc-51-142-114-105-168.dsl.bell.ca.53164: Flags [P.], seq 42552:42900, ack 37, win 501, length 348
23:07:06.705668 IP 159.203.43.128.ssh > bras-base-toroon0411w-grc-51-142-114-105-168.dsl.bell.ca.53164: Flags [P.], seq 42900:43264, ack 37, win 501, length 364
23:07:06.705756 IP bras-base-toroon0411w-grc-51-142-114-105-168.dsl.bell.ca.53164 > 159.203.43.128.ssh: Flags [.], ack 39908, win 1021, length 0
23:07:06.705864 IP 159.203.43.128.ssh > bras-base-toroon0411w-grc-51-142-114-105-168.dsl.bell.ca.53164: Flags [P.], seq 43264:43612, ack 37, win 501, length 348
23:07:06.705945 IP 159.203.43.128.ssh > bras-base-toroon0411w-grc-51-142-114-105-168.dsl.bell.ca.53164: Flags [P.], seq 43612:43808, ack 37, win 501, length 196
23:07:06.706032 IP 159.203.43.128.ssh > bras-base-toroon0411w-grc-51-142-114-105-168.dsl.bell.ca.53164: Flags [P.], seq 43808:44004, ack 37, win 501, length 196
23:07:06.706106 IP 159.203.43.128.ssh > bras-base-toroon0411w-grc-51-142-114-105-168.dsl.bell.ca.53164: Flags [P.], seq 44004:44200, ack 37, win 501, length 196
23:07:06.706192 IP 159.203.43.128.ssh > bras-base-toroon0411w-grc-51-142-114-105-168.dsl.bell.ca.53164: Flags [P.], seq 44200:44396, ack 37, win 501, length 196
23:07:06.706249 IP bras-base-toroon0411w-grc-51-142-114-105-168.dsl.bell.ca.53164 > 159.203.43.128.ssh: Flags [.], ack 40452, win 1026, length 0
23:07:06.706314 IP 159.203.43.128.ssh > bras-base-toroon0411w-grc-51-142-114-105-168.dsl.bell.ca.53164: Flags [P.], seq 44396:44744, ack 37, win 501, length 348
23:07:06.706405 IP 159.203.43.128.ssh > bras-base-toroon0411w-grc-51-142-114-105-168.dsl.bell.ca.53164: Flags [P.], seq 44744:44940, ack 37, win 501, length 196
23:07:06.706491 IP 159.203.43.128.ssh > bras-base-toroon0411w-grc-51-142-114-105-168.dsl.bell.ca.53164: Flags [P.], seq 44940:45136, ack 37, win 501, length 196
23:07:06.706565 IP 159.203.43.128.ssh > bras-base-toroon0411w-grc-51-142-114-105-168.dsl.bell.ca.53164: Flags [P.], seq 45136:45332, ack 37, win 501, length 196
23:07:06.706625 IP bras-base-toroon0411w-grc-51-142-114-105-168.dsl.bell.ca.53164 > 159.203.43.128.ssh: Flags [.], ack 41268, win 1023, length 0
23:07:06.706689 IP 159.203.43.128.ssh > bras-base-toroon0411w-grc-51-142-114-105-168.dsl.bell.ca.53164: Flags [P.], seq 45332:45680, ack 37, win 501, length 348
23:07:06.706739 IP bras-base-toroon0411w-grc-51-142-114-105-168.dsl.bell.ca.53164 > 159.203.43.128.ssh: Flags [.], ack 41856, win 1021, length 0
23:07:06.706803 IP 159.203.43.128.ssh > bras-base-toroon0411w-grc-51-142-114-105-168.dsl.bell.ca.53164: Flags [P.], seq 45680:46028, ack 37, win 501, length 348
23:07:06.706864 IP bras-base-toroon0411w-grc-51-142-114-105-168.dsl.bell.ca.53164 > 159.203.43.128.ssh: Flags [.], ack 42552, win 1026, length 0
23:07:06.706928 IP 159.203.43.128.ssh > bras-base-toroon0411w-grc-51-142-114-105-168.dsl.bell.ca.53164: Flags [P.], seq 46028:46376, ack 37, win 501, length 348
23:07:06.707004 IP 159.203.43.128.ssh > bras-base-toroon0411w-grc-51-142-114-105-168.dsl.bell.ca.53164: Flags [P.], seq 46376:46572, ack 37, win 501, length 196
23:07:06.707079 IP 159.203.43.128.ssh > bras-base-toroon0411w-grc-51-142-114-105-168.dsl.bell.ca.53164: Flags [P.], seq 46572:46768, ack 37, win 501, length 196
23:07:06.707155 IP 159.203.43.128.ssh > bras-base-toroon0411w-grc-51-142-114-105-168.dsl.bell.ca.53164: Flags [P.], seq 46768:46964, ack 37, win 501, length 196
23:07:06.707229 IP 159.203.43.128.ssh > bras-base-toroon0411w-grc-51-142-114-105-168.dsl.bell.ca.53164: Flags [P.], seq 46964:47160, ack 37, win 501, length 196
23:07:06.707303 IP 159.203.43.128.ssh > bras-base-toroon0411w-grc-51-142-114-105-168.dsl.bell.ca.53164: Flags [P.], seq 47160:47356, ack 37, win 501, length 196
23:07:06.707362 IP bras-base-toroon0411w-grc-51-142-114-105-168.dsl.bell.ca.53164 > 159.203.43.128.ssh: Flags [.], ack 43264, win 1023, length 0
23:07:06.707424 IP 159.203.43.128.ssh > bras-base-toroon0411w-grc-51-142-114-105-168.dsl.bell.ca.53164: Flags [P.], seq 47356:47704, ack 37, win 501, length 348
23:07:06.707501 IP 159.203.43.128.ssh > bras-base-toroon0411w-grc-51-142-114-105-168.dsl.bell.ca.53164: Flags [P.], seq 47704:47900, ack 37, win 501, length 196
23:07:06.707583 IP 159.203.43.128.ssh > bras-base-toroon0411w-grc-51-142-114-105-168.dsl.bell.ca.53164: Flags [P.], seq 47900:48096, ack 37, win 501, length 196
23:07:06.707659 IP 159.203.43.128.ssh > bras-base-toroon0411w-grc-51-142-114-105-168.dsl.bell.ca.53164: Flags [P.], seq 48096:48292, ack 37, win 501, length 196
23:07:06.707734 IP 159.203.43.128.ssh > bras-base-toroon0411w-grc-51-142-114-105-168.dsl.bell.ca.53164: Flags [P.], seq 48292:48488, ack 37, win 501, length 196
23:07:06.707788 IP bras-base-toroon0411w-grc-51-142-114-105-168.dsl.bell.ca.53164 > 159.203.43.128.ssh: Flags [.], ack 44004, win 1026, length 0
23:07:06.707788 IP bras-base-toroon0411w-grc-51-142-114-105-168.dsl.bell.ca.53164 > 159.203.43.128.ssh: Flags [.], ack 44744, win 1023, length 0
23:07:06.707893 IP 159.203.43.128.ssh > bras-base-toroon0411w-grc-51-142-114-105-168.dsl.bell.ca.53164: Flags [P.], seq 48488:48980, ack 37, win 501, length 492
23:07:06.707971 IP 159.203.43.128.ssh > bras-base-toroon0411w-grc-51-142-114-105-168.dsl.bell.ca.53164: Flags [P.], seq 48980:49176, ack 37, win 501, length 196
23:07:06.708061 IP 159.203.43.128.ssh > bras-base-toroon0411w-grc-51-142-114-105-168.dsl.bell.ca.53164: Flags [P.], seq 49176:49372, ack 37, win 501, length 196
23:07:06.708176 IP 159.203.43.128.ssh > bras-base-toroon0411w-grc-51-142-114-105-168.dsl.bell.ca.53164: Flags [P.], seq 49372:49568, ack 37, win 501, length 196
